,id,name,host_id,host_name,neighbourhood_group,neighbourhood,latitude,longitude,room_type,price,minimum_nights,number_of_reviews,last_review,reviews_per_month,calculated_host_listings_count,availability_365,diff_type
3,20345,"2 Double rooms for 4 persons, WI-FI",76809,Mila,Nou Barris,Vilapicina i la Torre Llobeta,41.4294969777,2.18155786439,Private room,25,2,72,2018-06-17,0.73,1,345,erased
43,80004,Parc Montjuic,431839,Xavier,Sants-Montjuïc,el Poble Sec,41.3718830582,2.1665608601,Entire home/apt,107,4,85,2018-06-27,0.98,1,72,erased
48,89790,Barcelona very central,488188,Pepote,Eixample,la Dreta de l'Eixample,41.3897565149,2.1767289631,Private room,90,5,21,2018-06-04,0.25,1,94,erased
52,101021,"Vista Real en suite, la Boheme chic",529756,Fabienne,Ciutat Vella,el Barri Gòtic,41.3803060383,2.17447166976,Entire home/apt,235,3,92,2018-06-25,1.11,2,196,erased
71,136043,Twin room (2 people only) in Quirky central flat,666414,Fiona,Sants-Montjuïc,el Poble Sec,41.3726039056,2.16670215581,Private room,60,2,65,2018-06-18,0.77,1,159,erased
74,141054,Great studio in the heart of Borne,686428,Sofia,Ciutat Vella,"Sant Pere, Santa Caterina i la Ribera",41.3870909547,2.18111910462,Entire home/apt,60,4,271,2018-06-16,3.15,1,287,erased
75,142122,You clean Rambla Anarchist Hide,620454,Reinhard,Ciutat Vella,el Barri Gòtic,41.3797825774,2.17529407888,Entire home/apt,50,17,24,2018-06-12,0.28,1,141,erased
82,155872,Piso en Barcelona - Park Guell,749525,Esther,Horta-Guinardó,el Carmel,41.4213720198,2.15483754409,Entire home/apt,55,2,57,2018-04-05,0.79,1,197,erased
112,199794,Centric Double Room Private Bathroom - month  rent,440825,Teresa,Eixample,l'Antiga Esquerra de l'Eixample,41.3833626403,2.15853030527,Private room,35,1,68,2018-06-06,1.14,1,234,erased
113,200257,We are back: Apartment in the heart of Barceloneta,978773,Simone,Ciutat Vella,la Barceloneta,41.3821753682,2.18886455683,Entire home/apt,115,3,30,2017-09-09,0.41,1,324,erased
115,202219,COMFORT AND RELAX IN BARCELONA,552024,Daniela,Ciutat Vella,el Barri Gòtic,41.3826737158,2.1743156355,Private room,40,3,69,2018-05-17,0.85,1,223,erased
132,234109,Large. Light. INCREDIBLE views!,1201857,Jordan,Eixample,el Fort Pienc,41.3996431815,2.18258672861,Entire home/apt,119,3,32,2017-05-01,0.4,2,303,erased
137,239492,CozyRoom&Garden Priv.Bathroom AC,1255733,Antonia,Sants-Montjuïc,el Poble Sec,41.3702605211,2.16102720421,Private room,36,4,157,2018-06-18,1.95,2,42,erased
139,241614,A Room With A Tune In Ramblas Area,1184485,Nacho,Ciutat Vella,el Barri Gòtic,41.3790570932,2.17690306784,Private room,30,32,24,2018-06-14,0.3,1,282,erased
148,259852,Center - Double w A/C - FreeWiFi,1363244,David,Ciutat Vella,el Raval,41.3813166774,2.16377945748,Private room,45,3,59,2018-06-11,0.73,4,2,erased
180,283500,"Large Bohemian suite, Ibiza downtown",529756,Fabienne,Ciutat Vella,el Barri Gòtic,41.3809437923,2.17534656058,Entire home/apt,195,3,66,2018-06-03,0.92,2,228,erased
193,317720,Apartamento completamente independiente + terraza,1631358,Fabio Ariel,Eixample,la Sagrada Família,41.4073664002,2.17957484554,Entire home/apt,40,15,2,2017-09-01,0.11,1,0,erased
199,330199,Room in a loft with a patio with a lemon tree,1684667,Rocio,Sants-Montjuïc,Sants,41.3793194773,2.13810642071,Private room,48,3,1,2015-10-30,0.03,1,53,erased
214,346160,Colorful Room in centre - 1 person,1727648,Carmen,Eixample,la Nova Esquerra de l'Eixample,41.3820026656,2.15049404577,Private room,35,1,23,2016-11-01,0.37,1,338,erased
237,380433,"Share FUN Apartment in ""Gracia""LOOK AT THE PHOTOS.",1908520,Fernando,Gràcia,la Vila de Gràcia,41.4001501123,2.15826699855,Shared room,19,3,96,2018-07-08,3.31,1,1,erased
283,452763,Beautiul flat in Gracia  Nice room ,2105783,Elena,Gràcia,la Vila de Gràcia,41.4047277718,2.15721459722,Private room,13,20,15,2018-07-09,0.21,2,182,erased
294,468639,Big room with exit to sunny terrace,2325968,Sikerult,Sants-Montjuïc,Sants - Badal,41.3738375547,2.12810964212,Private room,33,12,102,2018-05-13,1.4,1,26,erased
313,486014,nice room Barcelona centre,2405609,Cristobal,Eixample,el Fort Pienc,41.4000339181,2.17750613467,Private room,40,2,4,2018-03-01,0.05,1,285,erased
326,501220,HABITACIÓN EXTERIOR EN BARCELONA,2473416,Marisol,Sant Martí,el Camp de l'Arpa del Clot,41.4108206473,2.18640006419,Private room,25,2,40,2018-06-26,0.56,1,351,erased
354,521605,Beautiful space city center. Born. Wifi Takeaway.,2565364,Monica,Ciutat Vella,"Sant Pere, Santa Caterina i la Ribera",41.3838165735,2.17994881369,Entire home/apt,80,1,470,2018-06-28,6.38,1,31,erased
369,537901,"COSY, SPACIOUS and CENTRAL.  BORN",2015360,Enrique,Ciutat Vella,"Sant Pere, Santa Caterina i la Ribera",41.3842650348,2.18033861269,Entire home/apt,129,7,42,2018-06-17,0.89,1,15,erased
405,574080,Comfortable GRACIA 2-1,1310304,Lluís,Gràcia,la Vila de Gràcia,41.3991793625,2.15960552743,Entire home/apt,83,3,3,2018-06-06,0.05,1,320,erased
420,586079,Amazing Apartment,1354071,Ogo & Sim,Eixample,la Nova Esquerra de l'Eixample,41.3799600583,2.15167635506,Entire home/apt,158,3,35,2017-03-08,0.49,2,0,erased
421,586082,Cozy Apartment on the Rocafort,1354071,Ogo & Sim,Eixample,la Nova Esquerra de l'Eixample,41.3820509672,2.15225347165,Entire home/apt,150,3,8,2017-05-01,0.34,2,0,erased
472,641603,Great place in Barcelona!! Terrace!,1752496,Ruben,Gràcia,la Vila de Gràcia,41.4085475249,2.15758805611,Entire home/apt,95,31,282,2018-05-27,4.0,1,333,erased
474,643995,Silent and confortable room,3221716,Anna,Sants-Montjuïc,la Bordeta,41.3686666752,2.1342265827,Private room,22,1,65,2018-06-19,2.7,2,5,erased
481,655071,FIRA BARCELONA View Montjuic 1,3243301,Harry,Sants-Montjuïc,la Marina de Port,41.3584232799,2.1437745591,Entire home/apt,80,1,54,2017-03-23,0.82,2,299,erased
499,671951,NEAR RAMBLA POBLENOU AND BEACH,82522,Meritxell,Sant Martí,el Poblenou,41.4049428088,2.19886920124,Private room,33,2,105,2018-06-25,4.07,2,299,erased
503,674461,"ROOM CENTRAL, IDEAL for CITY VISITORS",3424464,Ramon,Sants-Montjuïc,el Poble Sec,41.3747577003,2.16796542272,Private room,22,3,419,2018-05-31,5.88,3,70,erased
530,695631,Your Oasis in Barcelona´s Downtown,3560699,Abans,Ciutat Vella,el Barri Gòtic,41.3838514401,2.17304238592,Entire home/apt,80,10,89,2015-09-27,1.26,2,85,erased
531,696308,NOU RAMBLA  3 BEDROOM APARTMENT,383697,Anna,Ciutat Vella,el Raval,41.3789030555,2.17385599679,Entire home/apt,185,3,61,2018-03-20,0.94,18,308,erased
533,697526,2 bed room with balcony and views,3573777,Nelly,Horta-Guinardó,Horta,41.4315403831,2.15778481521,Private room,36,1,0,,,4,202,erased
543,711658,"Big,nice apartment in centre with 2 portable a/c!",3534058,Bogi And Marçal,Ciutat Vella,el Raval,41.3810770492,2.16444572778,Entire home/apt,105,3,15,2018-04-02,0.31,1,199,erased
544,713340,Fantástica Gracia,3671829,Mayte,Gràcia,el Camp d'en Grassot i Gràcia Nova,41.4044853851,2.1644898201,Private room,30,5,8,2017-08-31,0.34,2,339,erased
545,713397,Piso en la fántastica Gracia,3671829,Mayte,Gràcia,el Camp d'en Grassot i Gràcia Nova,41.4052394058,2.16409239294,Private room,30,5,20,2018-05-19,0.33,2,283,erased
552,721464,31 Sicilia Apartment 4 bedrooms,3724467,Ana,Eixample,el Fort Pienc,41.3983360395,2.17643664226,Entire home/apt,999,3,0,,,12,73,erased
612,761338,BEAUTIFUL VIEWS OF THE CATEDRAL DEL MAR,3518596,Cecil,Ciutat Vella,"Sant Pere, Santa Caterina i la Ribera",41.3848847119,2.18031043726,Private room,55,1,120,2018-06-25,1.82,1,96,erased
614,763176,"ROOM CENTRIC, PERFECT for CITY VISITORS",3424464,Ramon,Sants-Montjuïc,el Poble Sec,41.3739176124,2.16836769012,Private room,24,4,389,2018-06-04,5.63,3,42,erased
624,773700,"2tnf CHARMING, IDEAL FOR TRAVELERS, LARGE WINDOWS!",3911721,Aurora,Sants-Montjuïc,el Poble Sec,41.3719423605,2.16645716083,Entire home/apt,90,1,2,2017-11-18,0.15,26,307,erased
679,838475,Flat next to Mobile World Congress  Fira Barcelona,4348181,Fiorella,Sants-Montjuïc,el Poble Sec,41.373620811,2.15586187876,Entire home/apt,70,4,12,2018-03-02,0.32,1,159,erased
692,845760,Twin Room near Ramblas,3541314,Yih,Ciutat Vella,el Barri Gòtic,41.3833788304,2.17646514293,Private room,48,2,42,2018-06-07,0.67,1,26,erased
731,865148,Grande I Apartment on Valencia St.,582060,Fernando,Eixample,la Dreta de l'Eixample,41.3990940599,2.17018903342,Entire home/apt,222,3,38,2018-06-20,0.6,23,321,erased
733,865309,Nice Cozy Apartment Valencia St. B,582060,Fernando,Eixample,la Dreta de l'Eixample,41.3972104557,2.16957729395,Entire home/apt,120,3,50,2018-06-24,0.85,23,312,erased
756,886418,Apartamento planta baja en Gràcia,4699362,Jordi,Gràcia,la Vila de Gràcia,41.4025077379,2.158209516,Entire home/apt,55,15,31,2018-06-13,0.48,1,253,erased
775,898460,Apartment by Park Guell,4382099,Paloma & Luiz,Gràcia,la Salut,41.4103441166,2.15054353791,Entire home/apt,68,10,1,2015-08-26,0.03,2,321,erased
776,898486,Amazing Apartment in the Center!!!!,729980,Soledad,Eixample,la Dreta de l'Eixample,41.3911256945,2.16340860112,Entire home/apt,80,1,199,2018-06-17,3.03,2,253,erased
796,922332,LUXURIOUS NEST•ANTIQUE PAINTINGS•SUNNY TERRACE •5★,4959266,Lux Apartments,Eixample,la Dreta de l'Eixample,41.3881987213,2.17097948973,Entire home/apt,129,2,56,2017-09-25,0.88,6,69,erased
807,929774,Sweet double room with private living (up to 4),4352041,Marta,Gràcia,la Vila de Gràcia,41.4043131467,2.15107517524,Private room,40,3,59,2018-07-04,4.47,2,220,erased
839,946213,The Zen Room in Sagrada Familia,2077920,Claudia,Eixample,la Sagrada Família,41.4074865253,2.17717004803,Private room,15,3,116,2017-09-26,1.81,3,156,erased
861,962115,Angla Boutique center apartment ! WiFi,1824192,Alex,Eixample,la Nova Esquerra de l'Eixample,41.382760899,2.15649240121,Entire home/apt,65,4,280,2018-07-02,4.34,1,261,erased
937,1018237,Room for 4 persons /shared bathroom.,3573777,Nelly,Horta-Guinardó,Horta,41.4317042482,2.15890310409,Private room,75,2,0,,,4,214,erased
959,1034761,OLYMPIC VILLAGE. CITY & BEACH,5695022,Rosario,Sant Martí,el Poblenou,41.3945280639,2.20111756721,Entire home/apt,120,1,25,2017-09-09,0.44,1,190,erased
974,1051555,Apartamentos Navas 2,5789146,Miguel,Sant Andreu,Navas,41.4144084384,2.18889408869,Entire home/apt,95,2,6,2018-01-15,0.28,1,323,erased
978,1057394,"Quiet, Centric perfect for families",3446677,Nuria,Eixample,la Dreta de l'Eixample,41.3918920966,2.17605408724,Entire home/apt,158,4,22,2018-06-22,0.35,2,299,erased
980,1060411,Bright and white double bedroom,2541323,Guillaume & Piermarco,Ciutat Vella,el Raval,41.3801984204,2.16933814819,Private room,55,2,19,2018-06-06,0.36,1,308,erased
1023,1099891,Nice bedroom near the beach!!,1430523,Nathalia,Sant Martí,el Poblenou,41.4028845444,2.20388138794,Private room,35,2,24,2018-06-03,1.06,2,284,erased
1026,1102197,FIRA BARCELONA View Montjuic 2,3243301,Harry,Sants-Montjuïc,la Marina de Port,41.357699454,2.14386044271,Entire home/apt,80,1,39,2017-09-30,0.71,2,294,erased
1047,1113493,DELUXE APT IN BARCELONA,6111318,Andrea,Sarrià-Sant Gervasi,el Putxet i el Farró,41.4083824267,2.14723834711,Private room,50,7,14,2018-07-01,0.39,1,30,erased
1054,1124365,TERRAZA Y SOL EN BARCELONA CENTRO!!,1906609,Ed,Ciutat Vella,el Barri Gòtic,41.3825852654,2.17624235689,Entire home/apt,96,10,7,2018-06-18,0.14,1,359,erased
1068,1144116,The Bamboo Room in Sagrada Familia,2077920,Claudia,Eixample,la Sagrada Família,41.4071792933,2.17796109995,Private room,15,3,147,2018-06-01,2.35,3,135,erased
1087,1159438,plaza de parking espaciosa,1645470,Dana,Eixample,la Sagrada Família,41.4079029993,2.17904959512,Private room,50,1,0,,,3,365,erased
1088,1159715,Cozy 2room in the heart of Old Town,4933443,Albert,Ciutat Vella,"Sant Pere, Santa Caterina i la Ribera",41.3850969406,2.17771799328,Entire home/apt,182,2,43,2018-01-02,0.7,1,333,erased
1099,1181739,VERY CENTRIC & SPACIOUS. Breakfast,3424464,Ramon,Sants-Montjuïc,el Poble Sec,41.3746620046,2.16914467642,Private room,26,4,375,2018-06-07,6.08,3,42,erased
1114,1196112,APART.FROM 8min.to CENTER & RAMBLAS,1035045,Montserrat,Nou Barris,Vilapicina i la Torre Llobeta,41.4289601333,2.18195017745,Private room,80,3,29,2018-06-18,0.53,7,357,erased
1118,1198074,005596_APARTAMENTO DE 2 DORMITORIOS,6544866,Mariana & Tomás,Eixample,la Dreta de l'Eixample,41.3912341433,2.17453016366,Entire home/apt,200,1,16,2018-06-29,0.56,8,298,erased
1139,1211322,Loft/Studio near Beach - Groups Offer,6614322,Pierre,Sant Martí,el Parc i la Llacuna del Poblenou,41.397277308,2.19075799935,Shared room,100,1,0,,,4,340,erased
1149,1216365,UrquinaonaScott Quiet and Central,1687524,Virginia,Eixample,la Dreta de l'Eixample,41.3907588789,2.17469682895,Entire home/apt,120,2,78,2018-05-06,1.35,2,7,erased
1168,1235315,ALL FLAT IN BARCELONA TO ENJOY,6734912,Xavi,Sants-Montjuïc,el Poble Sec,41.3739203222,2.16473311298,Private room,25,1,28,2018-07-08,8.32,1,258,erased
1174,1238107,Comfortable room in a lovely flat,6749912,Eugenia,Ciutat Vella,el Barri Gòtic,41.3805277539,2.17728199029,Private room,38,3,256,2018-07-05,4.15,2,289,erased
1185,1244587,Beautiful centric apartment–165m2,6553229,Vincent,Eixample,la Dreta de l'Eixample,41.3904895473,2.16509226443,Entire home/apt,280,2,148,2018-04-15,2.79,5,262,erased
1190,1252355,double room in town 10 min to the beach,6731972,Tomas,Eixample,la Sagrada Família,41.4108084748,2.17675748549,Private room,39,2,2,2018-07-04,0.85,2,190,erased
1203,1261435,Sunny Apartment in Sarrià ~ Gràcia,6870421,David,Sarrià-Sant Gervasi,Sant Gervasi - Galvany,41.4023807677,2.14418172701,Private room,29,1,5,2018-05-17,0.08,1,263,erased
1207,1266156,Views to Sagrada Familia & Terrace,2041901,Dani,Eixample,la Sagrada Família,41.4075471545,2.17932137096,Entire home/apt,90,3,58,2018-06-24,0.95,18,115,erased
1220,1269243,"Ramblas Boqueria 22, Friendly Rentals",136853,Fidelio,Ciutat Vella,el Raval,41.380299536,2.17218078773,Entire home/apt,150,3,62,2018-06-25,1.07,38,285,erased
1233,1279537,City center. Cozy and sunny,4188943,Sebastian,Gràcia,la Vila de Gràcia,41.3980826331,2.16125413616,Private room,60,1,51,2018-07-05,0.85,1,12,erased
1237,1283316,OPPORTUNITY- SEE VIEW,6613633,Anna,Sant Martí,Diagonal Mar i el Front Marítim del Poblenou,41.4058629496,2.20690840634,Private room,75,35,72,2018-05-11,1.19,1,338,erased
1249,1294669,Stylish Appartment in Centre,1878349,Maria,Ciutat Vella,el Barri Gòtic,41.3800024854,2.1751452063,Entire home/apt,200,4,28,2016-07-24,0.47,1,0,erased
1263,1307662,GORGEOUS 3bds by Catalonia Square,713364,Horacio,Eixample,la Dreta de l'Eixample,41.3912103317,2.17498271114,Entire home/apt,300,3,116,2018-06-13,1.95,2,247,erased
1268,1310738,Penthouse with pool and views,6421296,Oksana,Les Corts,Pedralbes,41.394772464,2.11400105795,Entire home/apt,170,20,0,,,5,144,erased
1269,1311736,Cozy artist APARTMENT CENTER Born,7128380,Max,Ciutat Vella,"Sant Pere, Santa Caterina i la Ribera",41.3868011491,2.18190565437,Entire home/apt,70,2,4,2016-09-07,0.11,1,0,erased
1274,1320647,Lovely Atico very central El BORN 5,3994718,Sergi,Ciutat Vella,"Sant Pere, Santa Caterina i la Ribera",41.38730337,2.17840772,Entire home/apt,95,32,39,2018-06-29,0.64,5,160,erased
1278,1326130,Cozy and sunny double room in Gràcia,2551412,Elena,Gràcia,la Vila de Gràcia,41.402089886,2.15462852194,Private room,90,4,11,2016-08-29,0.18,1,212,erased
1299,1346199,Duplex Loft near Beach - Groups Offer,6614322,Pierre,Sant Martí,el Parc i la Llacuna del Poblenou,41.397062776,2.19193717871,Entire home/apt,150,1,3,2018-05-27,0.16,4,365,erased
1303,1349311,Room & bathroom @ Sagrada Familia,2839207,M & K,Eixample,la Sagrada Família,41.4023570187,2.17111908017,Private room,40,2,36,2018-05-26,0.6,1,0,erased
1304,1351010,room in city center,7330880,Greta,Eixample,l'Antiga Esquerra de l'Eixample,41.3844787456,2.15721361158,Private room,27,27,19,2018-06-02,0.48,3,259,erased
1305,1354327,COSY and QUIET room in Barri Gotic,4181734,Gabriela,Ciutat Vella,el Barri Gòtic,41.3785666895,2.1786210153,Private room,30,3,111,2018-07-04,1.84,1,278,erased
1313,1362147,Beautiful and spacious flat in the city centre.,7394462,Jorge And Lauren,Ciutat Vella,el Raval,41.376834199,2.16903322638,Entire home/apt,180,5,10,2017-08-22,0.17,1,190,erased
1327,1383944,Loft near Beach - Groups Offer,6614322,Pierre,Sant Martí,el Parc i la Llacuna del Poblenou,41.395415726,2.19155047467,Entire home/apt,150,1,0,,,4,365,erased
1331,1387456,Biggest room in Art and Dream flat,6406863,Art And Dreams,Ciutat Vella,el Barri Gòtic,41.3784976331,2.1783712009,Private room,35,2,5,2016-06-19,0.09,2,23,erased
1337,1395589,Heart of Gotico - Pl Real - La Rambla -,7541360,Alejandro,Ciutat Vella,el Raval,41.3797035287,2.17312430878,Private room,50,1,63,2018-07-02,1.05,1,176,erased
1353,1408612,Un piso esta cerca de plaza españa. sant estacion.,7585009,Miyoung,Sants-Montjuïc,Hostafrancs,41.3770705622,2.14562054336,Entire home/apt,130,1,2,2018-05-29,0.75,1,0,erased
1359,1413577,NiceRoom in the GreenHeart of BCN ,1255733,Antonia,Sants-Montjuïc,el Poble Sec,41.3715167081,2.16049421389,Private room,45,4,54,2018-07-02,1.09,2,27,erased
1381,1444509,wonderful atic in Barcelona Center,4953854,Elisabetta,Ciutat Vella,"Sant Pere, Santa Caterina i la Ribera",41.3888087386,2.18498570985,Entire home/apt,99,1,31,2017-12-23,0.52,1,215,erased
1403,1480930,"Beautiful 3bd modernista, in Born",493289,Vita,Ciutat Vella,"Sant Pere, Santa Caterina i la Ribera",41.3852145368,2.18448412635,Entire home/apt,175,5,24,2017-07-29,0.46,1,314,erased
1416,1493025,Cozy loft with courtyard,1527960,Pere,Sant Martí,el Camp de l'Arpa del Clot,41.4136125115,2.18313304228,Entire home/apt,80,9,83,2018-06-14,1.44,1,0,erased
1417,1495715,Barcelona center -Eixample Esquerra,7994802,Màrius & Vero,Eixample,Sant Antoni,41.3768063912,2.15802489369,Entire home/apt,75,3,95,2018-06-30,2.32,2,279,erased
1419,1500939,Beautiful flat in Poblenou 7 min walking to beach,5664206,Paola,Sant Martí,la Vila Olímpica del Poblenou,41.3894255186,2.19500101865,Entire home/apt,100,3,5,2013-12-24,0.08,2,11,erased
1426,1511410,BEAUTIFUL PENTHOUSE IN THE CENTER,7774805,Pablo,Eixample,el Fort Pienc,41.3945258156,2.181698176,Entire home/apt,120,2,6,2016-08-13,0.17,1,0,erased
1427,1516580,"CENTRAL,SUNNY IN EIXAMPLE BOUTIQUES",2922864,Ana,Eixample,l'Antiga Esquerra de l'Eixample,41.3922426366,2.14611473796,Entire home/apt,80,7,14,2018-06-30,0.24,2,364,erased
1436,1524681,Three bedrooms Apartment with terrace,6544866,Mariana & Tomás,Eixample,la Dreta de l'Eixample,41.390722397,2.17338042319,Entire home/apt,220,1,23,2018-06-02,0.45,8,251,erased
1437,1527831,Penthouse Apartment,6544866,Mariana & Tomás,Eixample,la Dreta de l'Eixample,41.3925722711,2.17296757627,Entire home/apt,210,1,11,2018-04-21,0.27,8,271,erased
1444,1542038,SAGRADA FLIA. IDEAL FAMILIES & MBA'students,5664206,Paola,Eixample,la Sagrada Família,41.4034054064,2.17544169921,Entire home/apt,100,15,9,2016-08-29,0.15,2,337,erased
1447,1555942,BIG MODERNIST APPARTMENT CLOSE TO LA PEDRERA,6976046,Albert,Eixample,l'Antiga Esquerra de l'Eixample,41.3872310035,2.15199233544,Entire home/apt,290,1,4,2015-10-14,0.11,3,363,erased
1450,1562113,Make yourself at home in Barcelona,1167882,Javier,Gràcia,la Vila de Gràcia,41.4046423478,2.16079835069,Entire home/apt,196,6,7,2018-05-15,0.15,1,231,erased
1454,1565255,Loft 100m ² à 1km de la plage,6614322,Pierre,Sant Martí,el Parc i la Llacuna del Poblenou,41.3968464224,2.19055733309,Entire home/apt,150,1,1,2018-04-29,0.41,4,348,erased
1469,1586889,Spectacular triple room with balcon,3038197,Maria Antonia,Eixample,Sant Antoni,41.3770007352,2.15240013344,Private room,64,1,249,2018-07-02,4.6,6,304,erased
1473,1594768,Private sunny room in local Barcelona,8492689,Carmen,Sant Martí,el Clot,41.4072105144,2.18868507397,Private room,60,3,27,2018-06-17,0.47,1,212,erased
1489,1617814,NICE Room+Wifi+Centric,2603961,Jessy Y Alex,Eixample,la Nova Esquerra de l'Eixample,41.3763449719,2.14988322151,Private room,25,3,22,2018-06-07,0.38,7,261,erased
1496,1629134,Quiet room in Sants,3221716,Anna,Sants-Montjuïc,la Bordeta,41.3677954472,2.13554162184,Private room,25,1,92,2018-07-02,3.82,2,6,erased
1499,1631864,HUGE 314ft BEDROOM IN BARCELONA CENTER! +WIFI,4457781,Sebas,Ciutat Vella,el Raval,41.3761318799,2.17125563851,Private room,60,2,65,2018-05-16,1.4,1,201,erased
1508,1654165,Barcelona cosy studio w/ terrace,125648,Steffen,Ciutat Vella,el Raval,41.3785978844,2.16850538571,Entire home/apt,85,3,18,2015-12-26,0.35,1,6,erased
1514,1668199,Alquiler de habitación doble ,8833942,Montserrat,Sants-Montjuïc,Sants,41.373483967,2.13377593653,Private room,25,3,101,2017-02-27,1.84,1,190,erased
1534,1691573,Bright  room,8936234,Adri,Sants-Montjuïc,el Poble Sec,41.3716235102,2.16432556554,Private room,24,1,59,2018-04-15,1.5,3,326,erased
1592,1811399,Flat in the best location in BCN,7295487,Deima,Eixample,el Fort Pienc,41.3984810205,2.17606842784,Entire home/apt,60,12,7,2016-07-13,0.15,1,5,erased
1609,1830372,Nice studio in 150 m from Camp Nou,9547606,Miyya,Sants-Montjuïc,Sants - Badal,41.3781177393,2.1292725478,Entire home/apt,39,1,143,2018-06-23,2.67,9,297,erased
1616,1839651,"Clean, sunny and cozy room Camp Nou",9547606,Miyya,Les Corts,la Maternitat i Sant Ramon,41.381906271,2.12705977959,Private room,9,1,72,2018-01-13,1.31,9,354,erased
1617,1840475,POP ART APARTMENT FAMILIES &GROUPS,3937003,Pedro,Eixample,la Sagrada Família,41.4014511868,2.17870835925,Entire home/apt,80,1,173,2018-06-13,3.11,8,319,erased
1626,1859946,SILVER APARTMENT GIR80,9703174,Pep,Eixample,la Dreta de l'Eixample,41.3957110947,2.17135813104,Entire home/apt,195,2,5,2018-06-16,0.1,37,230,erased
1633,1880690,Two Double Bedrooms near Sagrada Familia,6830217,René,Eixample,el Fort Pienc,41.4012208822,2.18548184906,Entire home/apt,110,2,11,2018-06-24,0.2,2,219,erased
1649,1903974,Habitación amplia centro Barcelona,8587915,Humberto,Eixample,la Nova Esquerra de l'Eixample,41.3813366107,2.1530283405,Private room,45,3,49,2018-07-09,1.04,1,302,erased
1658,1912635,"APPART À NEUF, ENSOLEILLÉ EIXAMPLE",2922864,Ana,Eixample,la Nova Esquerra de l'Eixample,41.3843395906,2.14318384855,Entire home/apt,95,7,12,2018-01-06,0.35,2,40,erased
1680,1938422,Gem in the heart of BCN,10028428,Vi,Eixample,la Dreta de l'Eixample,41.3889565964,2.16956074853,Entire home/apt,168,3,29,2018-06-02,0.54,1,19,erased
1697,1982900,Fabulous 3bedroom Charm Long Stays,10231574,Graciela Rodriguez,Eixample,Sant Antoni,41.3816720936,2.16118046466,Entire home/apt,150,32,41,2016-11-19,0.75,3,365,erased
1701,1987751,Wide room near the beach,10252018,Ariadna,Sant Martí,el Poblenou,41.3985326913,2.19608790679,Private room,21,2,113,2018-06-09,2.2,3,186,erased
1710,2007682,BLACK APARTMENT 102,9703174,Pep,Eixample,la Dreta de l'Eixample,41.3961600442,2.1702606932,Entire home/apt,295,2,72,2018-06-28,1.5,37,190,erased
1734,2048782,"Cheap, next to the Picasso Museum.",10469973,A.Roberto,Ciutat Vella,"Sant Pere, Santa Caterina i la Ribera",41.3843039536,2.17921878365,Entire home/apt,45,4,137,2018-06-19,2.5,3,219,erased
1754,2070190,3 bedroom apartment near Sants and Camp Nou,10704,Weflating,Eixample,la Nova Esquerra de l'Eixample,41.3831910208,2.14792269463,Entire home/apt,88,3,9,2018-05-11,0.21,52,318,erased
1786,2109549,Best area in Barcelona Center,10755240,Sebastian,Ciutat Vella,"Sant Pere, Santa Caterina i la Ribera",41.3875289849,2.17770647151,Entire home/apt,76,3,251,2018-07-05,4.67,1,210,erased
1789,2111247,Sagrada Familia.100% Renov.Jun  2015,3039107,Manuel,Horta-Guinardó,el Guinardó,41.4142966888,2.17708168181,Entire home/apt,109,3,100,2018-06-25,1.91,17,306,erased
1792,2114842,Apartment in the Gothic Quarter,10469973,A.Roberto,Ciutat Vella,el Barri Gòtic,41.3802989439,2.17813207939,Entire home/apt,40,3,135,2018-06-22,2.46,3,231,erased
1807,2141148,NICE ROOM IN THE HEART OF GRACIA (BARCELONA),10820225,Nuria,Gràcia,la Vila de Gràcia,41.4057295268,2.15569828035,Private room,30,2,70,2018-06-17,1.8,1,268,erased
1809,2141891,Central and Sunny Apartment!! AMAZING WIEW!!,5515536,Alessandro,Eixample,el Fort Pienc,41.3968251352,2.18388475475,Entire home/apt,250,3,62,2018-06-03,1.22,3,337,erased
1822,2168176,SUNNY ROOM RAMBLA GOTHIC HEART WiFi,10985040,Victoria,Ciutat Vella,el Barri Gòtic,41.3824852868,2.17895185199,Private room,40,2,125,2018-06-21,2.3,1,342,erased
1824,2171702,OLYMPIC PANORAMIC ATTIC,4086313,Magi,Horta-Guinardó,Sant Genís dels Agudells,41.4234933795,2.14066641308,Entire home/apt,80,3,68,2018-06-21,1.32,2,109,erased
1859,2224589,WHITE APARTMENT 111,9703174,Pep,Eixample,la Dreta de l'Eixample,41.3950931531,2.17002021838,Entire home/apt,125,2,45,2018-04-29,0.84,37,246,erased
1865,2230683,Beautiful room with double bed,11357754,Fabián,Sarrià-Sant Gervasi,el Putxet i el Farró,41.4092562966,2.13952348825,Private room,45,2,30,2018-06-03,1.21,1,253,erased
1866,2232591,PENTHOUSE RAMBLAS,11149400,Manuel,Ciutat Vella,el Raval,41.3796289866,2.17159039994,Entire home/apt,120,4,155,2018-06-26,2.88,1,322,erased
1892,2288858,LOVELY ROOM IN THE HEART OF BCN/PRIVATE BATHROOM,6701959,Eloi,Ciutat Vella,"Sant Pere, Santa Caterina i la Ribera",41.3888215531,2.17623870572,Private room,45,3,14,2017-10-03,0.28,2,92,erased
1893,2288872,Apartment close to Sagrada Familia,7285822,Arturo,Eixample,la Sagrada Família,41.4049914727,2.17502019637,Entire home/apt,88,3,142,2018-06-23,5.77,1,313,erased
1901,2299299,Big Room @Barcelona center-Eixample,11713353,Ricard,Eixample,la Nova Esquerra de l'Eixample,41.3812905107,2.15456342287,Private room,24,2,4,2017-07-24,0.18,9,190,erased
1921,2314670,SUNNY BALCONY ROOM & PRIVATE BATH,6701959,Eloi,Ciutat Vella,"Sant Pere, Santa Caterina i la Ribera",41.3884269496,2.17695495865,Private room,47,5,6,2017-08-18,0.12,2,104,erased
1932,2337842,NEW Terraza modernista Ps de Gràcia,11936605,Luxa,Eixample,la Dreta de l'Eixample,41.3918822756,2.16586161381,Entire home/apt,60,32,17,2018-06-23,0.32,3,334,erased
1938,2344904,Penthouse with terrace in Barcelona,11961777,Ferran,Eixample,la Dreta de l'Eixample,41.3964633666,2.16440434713,Entire home/apt,230,4,55,2018-06-18,1.04,1,83,erased
