,id,name,host_id,host_name,neighbourhood_group,neighbourhood,latitude,longitude,room_type,price,minimum_nights,number_of_reviews,last_review,reviews_per_month,calculated_host_listings_count,availability_365,diff_type
15305,24714355,Casa con jardin en Barcelona cerca metro,35138000,Andrea,Horta-Guinardó,Horta,41.4329753573,2.15772435747,Entire home/apt,290,3,0,,,1,130,erased
15306,24717505,Port Vell Nice Comfortable Apartment City Center,186831126,Rafael-Carlos,Ciutat Vella,el Barri Gòtic,41.3818204872,2.18023399975,Entire home/apt,225,3,9,2018-06-18,4.66,1,169,erased
15307,24721277,Delightfully flat (3bed) with lot of natural light,186867951,Ester,Sants-Montjuïc,Sants,41.3838411899,2.14246398253,Entire home/apt,120,1,1,2018-07-10,1.0,1,119,erased
15308,24721583,Provenza 1  Sagrada Familia,36780006,Juan Carlos,Sant Martí,el Camp de l'Arpa del Clot,41.4116704592,2.18270635719,Entire home/apt,150,3,1,2018-06-12,1.0,5,343,erased
15309,24721808,Gran casa con vistas a Barcelona y Montserrat,7656309,Monica,Sarrià-Sant Gervasi,"Vallvidrera, el Tibidabo i les Planes",41.4142269295,2.10948110029,Entire home/apt,950,7,0,,,1,0,erased
15313,24723598,SHINING GREEN HOME IN PLAZA CATALUNYA,181688018,Mary E Lu,Eixample,la Dreta de l'Eixample,41.3868677122,2.16539389946,Entire home/apt,200,1,4,2018-06-24,3.53,2,43,erased
15320,24732931,habitación confortable en piso cálido y tranquilo,109183464,Yela,Horta-Guinardó,el Baix Guinardó,41.4145962796,2.16961909301,Private room,25,1,0,,,2,363,erased
15321,24733575,LUXURY ROOM BEACH BCN+Priv bathroom,65846460,Inés,Sant Martí,el Poblenou,41.4056749148,2.19927846805,Private room,61,3,1,2018-07-08,1.0,4,220,erased
15327,24740814,Modern flat near the beach in trendy area-Poblenou,187047630,Xavier,Sant Martí,el Poblenou,41.4040348777,2.20671584026,Private room,35,1,7,2018-07-04,4.38,1,0,erased
15333,24743254,Born Sweet  Place,187064582,Juan Y Andres,Ciutat Vella,"Sant Pere, Santa Caterina i la Ribera",41.3858550999,2.18168302003,Entire home/apt,90,2,9,2018-07-09,4.09,1,290,erased
15334,24745203,Bonito piso céntrico en Barcelona,103963893,Erika,Eixample,la Dreta de l'Eixample,41.3991681718,2.1716956395,Entire home/apt,150,2,3,2018-07-09,1.5,1,73,erased
15340,24747692,Beautiful apartment in Barcelona Centre ( Gotic),8779742,Diogo,Ciutat Vella,el Barri Gòtic,41.3816325185,2.17634572111,Entire home/apt,80,3,8,2018-06-25,3.75,3,212,erased
15343,24748532,Lovely Enamorados,18096277,Jon  & Jon,Eixample,la Sagrada Família,41.4028422947,2.18295501631,Entire home/apt,75,5,3,2018-06-23,1.38,6,156,erased
15344,24748657,Ramblas super convenient apartment,60876439,Anthony,Ciutat Vella,el Raval,41.3785753395,2.17424809719,Entire home/apt,100,2,3,2018-07-09,1.53,1,232,erased
15349,24749671,Stunning Barcelona Retreat with Amazing Cathedral Views | Rooftop Pool,185236504,Sensation Sagrada By Leavetown,Eixample,la Sagrada Família,41.4048943,2.17215459529,Entire home/apt,180,2,0,,,7,225,erased
15350,24749738,"4 Bedroom Apartment with Full Kitchen, Balcony+ Rooftop Pool Access",185236504,Sensation Sagrada By Leavetown,Eixample,la Sagrada Família,41.4047724441,2.17290432042,Entire home/apt,233,2,0,,,7,217,erased
15354,24753835,Cozy apartment in the center. Wi-Fi,13685171,Gala,Ciutat Vella,el Barri Gòtic,41.3790421918,2.17884351515,Entire home/apt,60,1,5,2018-06-24,3.26,1,29,erased
15366,24765139,HABITACIÓN GRANDE,186114746,Juana,Eixample,Sant Antoni,41.3769634989,2.15912690526,Private room,55,2,6,2018-06-19,2.9,1,161,erased
15369,24766816,Appartamento Barcellona quartiere Borne,21519766,Gianmarco,Ciutat Vella,"Sant Pere, Santa Caterina i la Ribera",41.3871045848,2.18002086884,Private room,30,3,0,,,1,4,erased
15370,24766895,Old City 2 Bedrooms Apartment Heart of Barcelona,187255312,Juan,Ciutat Vella,"Sant Pere, Santa Caterina i la Ribera",41.3881902159,2.17636707072,Entire home/apt,190,3,9,2018-06-20,4.66,1,53,erased
15373,24771398,30sqm double room ensuite. own bath. center bcn.,183935014,Elisabeth,Sarrià-Sant Gervasi,Sant Gervasi - Galvany,41.3989015662,2.14978046538,Private room,85,2,2,2018-06-03,1.02,1,72,erased
15379,24773962,Habitación enfrente del parque Joan MIró,186933837,Erika,Eixample,la Nova Esquerra de l'Eixample,41.3793030336,2.14758869654,Private room,14,3,5,2018-06-24,2.27,2,143,erased
15380,24774258,Comfortable Room in Plaza España,38348835,Matías,Sants-Montjuïc,la Font de la Guatlla,41.3707005983,2.14576993877,Private room,22,2,2,2018-05-13,1.02,1,36,erased
15384,24778210,Sant Antoni Comfortable Apartment Barcelona Center,187342576,Marcel,Ciutat Vella,el Raval,41.3801640447,2.16570533736,Entire home/apt,180,3,6,2018-06-18,2.77,1,78,erased
15389,24788221,"STUDIO FLAT - Central location, 100% private",186577411,Carlo,Eixample,l'Antiga Esquerra de l'Eixample,41.3874347728,2.1648213272,Entire home/apt,127,1,2,2018-06-13,1.87,2,90,erased
15390,24790635,NEXT TO SAGRADA FAMILA TOWN QUIET AND SAFE,35064135,Matias,Eixample,el Fort Pienc,41.3993069331,2.17839525666,Private room,35,1,11,2018-07-06,5.69,1,88,erased
15391,24791137,Big room next plaza España,187434104,Paulo,Sants-Montjuïc,Hostafrancs,41.3742301022,2.14769554497,Private room,42,1,8,2018-06-17,3.69,2,341,erased
15400,24794234,Big flat WALK / 5 rooms  RAMBLAS,184980586,Alvaro,Ciutat Vella,el Barri Gòtic,41.3793335776,2.17735669287,Entire home/apt,100,1,2,2018-06-29,1.09,4,70,erased
15409,24802946,Great Double Bedroom in Beautiful Flat w/ Balcony,187107328,Roman,Eixample,l'Antiga Esquerra de l'Eixample,41.3889182814,2.15007620814,Private room,55,2,0,,,2,22,erased
15411,24804763,[LastMinute]DUPLEX WALK TO RAMBLAS (up to 7 guest),2132723,Adry,Ciutat Vella,el Raval,41.3769922889,2.16702414358,Entire home/apt,122,1,8,2018-06-26,3.81,3,28,erased
15415,24813013,LOVELY APARTMENT IN THE HEART OF BARCELONA !!,187597322,Anna,Eixample,la Dreta de l'Eixample,41.3861989835,2.16588080633,Entire home/apt,160,7,1,2018-06-19,1.0,1,65,erased
15418,24814931,Perfect apartment,114285783,Sissi,Sant Martí,el Parc i la Llacuna del Poblenou,41.3932366655,2.18963375282,Private room,70,2,1,2018-06-04,0.81,1,12,erased
15420,24817461,Apartamento en Eixample Barcelona,5171340,Rachel,Eixample,la Sagrada Família,41.4045828948,2.18380133988,Entire home/apt,100,8,1,,,3,1,erased
15432,24820935,Cozy room next plaza España,187434104,Paulo,Sants-Montjuïc,Hostafrancs,41.3762298132,2.1447404974,Private room,35,1,15,2018-07-02,6.82,2,352,erased
15433,24820945,Habitación Barcelona centro perfect holiday,126501082,Miguel,Sant Martí,el Clot,41.407368649,2.18529290142,Private room,29,1,3,2018-06-03,1.73,2,251,erased
15435,24822970,Habitación doble cómoda y bonita con baño privado,110960700,Enrico,Sants-Montjuïc,Sants,41.374532921,2.13140049192,Private room,10,1,1,2018-05-10,0.48,1,89,erased
15438,24827031,Quiet apartment,84307851,Lora,Gràcia,el Camp d'en Grassot i Gràcia Nova,41.4064710239,2.1670095413,Entire home/apt,120,1,3,2018-06-15,2.05,1,18,erased
15445,24831255,Artistic and cozy loft near Mercat Sant Antoni,4128416,Nani,Ciutat Vella,el Raval,41.3798513998,2.16498100056,Entire home/apt,180,2,2,2018-06-19,1.58,1,87,erased
15447,24832484,Amazing central room near La Rambla,26600697,Lina,Ciutat Vella,el Raval,41.3782137892,2.17134456453,Private room,40,6,0,,,1,16,erased
15448,24833507,Habitación Barcelona Sagrada Familia,126501082,Miguel,Sant Martí,el Clot,41.4074965385,2.18547391808,Private room,29,1,2,2018-05-25,1.09,2,361,erased
15460,24847934,Lovely apartment in the center of BARCELONA,91059008,Dasha,Ciutat Vella,"Sant Pere, Santa Caterina i la Ribera",41.3885513961,2.17845362246,Entire home/apt,121,2,6,2018-07-08,3.05,1,48,erased
15467,24850658,Loft Bombonera 2018.,70933101,Dolors,Sant Martí,el Camp de l'Arpa del Clot,41.4096511738,2.18413793731,Private room,60,3,3,2018-06-18,1.76,2,363,erased
15468,24851253,THE BEST APARTMENT IN GOTHIC,184429816,Olga,Ciutat Vella,el Barri Gòtic,41.3809297258,2.18084132101,Entire home/apt,265,6,4,2018-07-06,2.61,1,56,erased
15472,24853188,Room king size bed in Las Ramblas,54820196,Omar,Ciutat Vella,el Raval,41.3797227812,2.17447410706,Shared room,40,1,0,,,1,365,erased
15474,24853568,Easy and cheap!,11825279,Neit,Sants-Montjuïc,la Font de la Guatlla,41.3691775488,2.14347087663,Private room,23,1,12,2018-07-08,6.1,3,234,erased
15476,24859586,Cozy and bright apartment in Vila de Gracia,6162822,Andrea,Gràcia,la Vila de Gràcia,41.4062750049,2.15791175699,Entire home/apt,120,5,0,,,2,44,erased
15477,24859653,habitación pequeña con cama sencilla,187767945,Maria,Eixample,el Fort Pienc,41.3994280609,2.18025509438,Private room,33,1,0,,,1,365,erased
15487,24868100,--HABITACION GRUPO--,144559506,Lou,Ciutat Vella,el Raval,41.3824594813,2.16909386108,Private room,35,1,1,2018-06-19,1.0,5,322,erased
15488,24870129,Cosy Room Privet Bathroom Privet Kitchen,19959066,Ruben,Eixample,la Dreta de l'Eixample,41.3899773305,2.17471423827,Private room,50,4,0,,,3,95,erased
15490,24872661,Big sunny room! City center!!,176608035,Uncredable,Sant Martí,el Parc i la Llacuna del Poblenou,41.3943063688,2.18869892469,Private room,40,1,0,,,2,346,erased
15491,24872704,Great to save money,11825279,Neit,Sants-Montjuïc,Hostafrancs,41.3710521747,2.14371641899,Private room,17,1,4,2018-07-06,3.16,3,282,erased
15492,24873382,Casa Chic !,145179021,Chris,Sarrià-Sant Gervasi,Sant Gervasi - la Bonanova,41.404768264,2.13769167656,Entire home/apt,140,3,8,2018-07-08,4.9,1,263,erased
15497,24881120,Charming Apartment near La Rambla and Port of BCN,188102263,Francisco Jose,Ciutat Vella,el Raval,41.3782994263,2.17263807339,Entire home/apt,190,1,5,2018-06-21,2.73,1,66,erased
15500,24882410,Gothic Quarter near the La Rambla,186041843,Ksenia,Ciutat Vella,el Barri Gòtic,41.3808848242,2.17622435718,Entire home/apt,120,2,1,2018-06-30,1.0,1,15,erased
15501,24884405,90 m2 Great Apartment in the City Center - Parking,44587781,Alix,Sant Martí,el Clot,41.4133242917,2.18827937863,Entire home/apt,150,2,0,,,1,55,erased
15507,24887417,Cozy Private Room,186074302,Juan Cruz,Eixample,Sant Antoni,41.3761715051,2.16020803641,Private room,35,2,12,2018-07-07,5.81,2,15,erased
15509,24887741,Great bedroom for 2 downtown Barcelona,8464380,Ginette,Ciutat Vella,"Sant Pere, Santa Caterina i la Ribera",41.3843254681,2.18189961865,Private room,30,1,5,2018-06-24,2.73,3,291,erased
15510,24890126,LUX Gotico Apartment*****,165389835,Silvir,Ciutat Vella,"Sant Pere, Santa Caterina i la Ribera",41.3845905634,2.17867953257,Entire home/apt,115,4,6,2018-07-05,3.05,1,38,erased
15515,24893711,Las Ramblas,126502401,Nino,Ciutat Vella,el Raval,41.3775815845,2.17332882098,Private room,54,1,0,,,1,0,erased
15527,24905797,JUST RENOVATED FLAT HISTORIC BUILDING GOTIC AREA,131573935,Sabrina,Ciutat Vella,el Barri Gòtic,41.3788814461,2.17655517845,Entire home/apt,100,3,3,2018-06-18,1.53,1,91,erased
15529,24906388,Calvet,188303269,Javier,Sarrià-Sant Gervasi,Sant Gervasi - Galvany,41.3964277218,2.14165829051,Entire home/apt,220,1,0,,,1,121,erased
15533,24909024,Habitación parque Ciutadella,99116781,Alba,Sant Martí,el Parc i la Llacuna del Poblenou,41.3922098723,2.18576114706,Private room,42,1,1,2018-06-10,1.0,2,205,erased
15534,24909322,Lovely apartment next to city center.,179309986,Milena,Eixample,Sant Antoni,41.3759886503,2.15935477175,Entire home/apt,99,2,5,2018-06-24,3.26,1,37,erased
15537,24911240,Single room in Barcelona,188337210,Josué,Sant Martí,la Verneda i la Pau,41.4236983705,2.2051845303,Private room,18,1,19,2018-07-03,10.36,1,0,erased
15546,24918052,Small cozy room with double bed in the center,188388397,Михаил,Gràcia,el Camp d'en Grassot i Gràcia Nova,41.403817166,2.16412679199,Private room,49,1,6,2018-07-01,2.95,1,156,erased
15548,24924851,Flat in barcelona city center for music lovers,23331431,Max,Ciutat Vella,el Raval,41.3783203567,2.17150332631,Private room,75,1,3,2018-06-04,1.53,1,345,erased
15552,24928213,Sagrada Familia Shared Room,186570528,Hostal,Gràcia,la Vila de Gràcia,41.4081222153,2.15952645439,Shared room,22,1,8,2018-06-25,4.07,7,322,erased
15559,24930479,Plaza CATALUÑA ***** BIG central room,152464438,Oscar,Ciutat Vella,el Raval,41.3826899039,2.16996824904,Private room,69,1,9,2018-06-27,5.19,3,81,erased
15560,24930713,Apartamento centro bcn,188485729,Valentina,Ciutat Vella,el Raval,41.3756574914,2.17090032264,Entire home/apt,70,1,10,2018-07-02,5.45,1,120,erased
15564,24932501,Sunny Penthouse in Gracia,23980245,Mag,Gràcia,el Camp d'en Grassot i Gràcia Nova,41.4041595651,2.16287025251,Entire home/apt,120,2,1,2018-05-27,0.67,1,86,erased
15571,24936716,Fall in love with Barcelona : -),188328138,Ruben,Ciutat Vella,"Sant Pere, Santa Caterina i la Ribera",41.3846921437,2.18041571797,Entire home/apt,63,4,3,2018-06-17,2.14,1,76,erased
15575,24941084,SUNNY • 2BDR • Luxury • Heart • Ramblas • Level 5★,4959266,Lux Apartments,Eixample,Sant Antoni,41.3760489104,2.16216771151,Entire home/apt,159,3,0,,,6,313,erased
15580,24942193,Piso muy bien comunicado en Barrio de Les Corts,188564009,Africa,Les Corts,les Corts,41.3859299544,2.13041981869,Private room,40,2,3,2018-06-27,2.81,1,69,erased
15581,24942756,PARALELO ROOM WITH BALCONY AND BARCELONA VIEWS,37674011,BrazilianApartments,Ciutat Vella,el Raval,41.3753873063,2.17257845391,Private room,55,3,8,2018-07-02,4.71,1,246,erased
15585,24949085,Center Rocafort Only girls,71355528,Majestic,Eixample,la Nova Esquerra de l'Eixample,41.3821116819,2.15150461278,Private room,31,15,0,,,10,365,erased
15586,24950796,Hermosa Habitación Privada,176756749,Elsa,Sarrià-Sant Gervasi,el Putxet i el Farró,41.4044472983,2.14298327765,Private room,35,1,5,2018-06-11,2.59,2,359,erased
15587,24951526,Bright three bedroom apartment with balconies,2608724,Hector Alvaro,Eixample,Sant Antoni,41.3750840325,2.16634879023,Entire home/apt,275,1,0,,,4,236,erased
15590,24955458,Mood color - VIOLET,179923213,Marina,Sant Martí,el Parc i la Llacuna del Poblenou,41.3935444509,2.1883511861,Entire home/apt,70,2,0,,,1,111,erased
15592,24957413,Hermoso apartamento en el Raval,188679307,Daniel,Ciutat Vella,el Raval,41.3754489167,2.1675625965,Entire home/apt,99,1,19,2018-07-08,10.56,2,221,erased
15597,24959864,"Cozy comfortable bright apt centric (balcony, AC)",3328813,Alex,Eixample,la Nova Esquerra de l'Eixample,41.3818165537,2.14714283922,Entire home/apt,120,3,1,2018-05-30,0.71,3,7,erased
15601,24961051,"NICE APARTMENT, FAMILY AREA, NEAR SAGRADA FAMILIA",188702912,Aurora,Sant Martí,el Camp de l'Arpa del Clot,41.4105412141,2.18265460273,Entire home/apt,110,2,0,,,1,75,erased
15604,24965625,Cute Room near the Beach+Center!!!,32614470,Yuli,Sant Martí,la Vila Olímpica del Poblenou,41.3891855045,2.19352934856,Private room,49,2,0,,,3,43,erased
15608,24967427,Double room in modern central Barcelona apartment,130938934,Diane,Ciutat Vella,"Sant Pere, Santa Caterina i la Ribera",41.3838284558,2.18129664674,Private room,70,1,3,2018-07-02,2.81,1,34,erased
15610,24968227,amazing sunny room in a artsy apartment <3,188752589,Martha,Sant Martí,el Clot,41.4086454267,2.1868354989,Private room,36,2,8,2018-06-24,4.14,1,310,erased
15611,24968823,Habitación doble sagrada familia,18832972,Nico Y Flor,Sant Martí,el Camp de l'Arpa del Clot,41.4079442709,2.1830487874,Private room,50,2,0,,,1,364,erased
15617,24976952,Quirky & Spacious Flat close to Metro (20% off),188828040,Mo,Ciutat Vella,el Raval,41.3808073219,2.1640971813,Entire home/apt,27,1,0,,,3,28,erased
15623,24977289,Lovely NEW room in Barceloneta by the beach + wifi,62848689,Eve,Ciutat Vella,la Barceloneta,41.3777157653,2.1891871822,Private room,75,2,9,2018-07-07,6.75,1,57,erased
15624,24977846,big and sunny room downtown gothic next to ramblas,188834956,J,Ciutat Vella,el Barri Gòtic,41.3786835411,2.17824018834,Private room,70,3,1,2018-05-17,0.55,1,155,erased
15625,24977888,Apartment up to 4 people Barcelona,188834121,Flexiapparts,Nou Barris,les Roquetes,41.4475220637,2.17470544998,Entire home/apt,90,6,0,,,5,212,erased
15639,24983740,Apartamento tranquilo en sagrada familia Barcelona,188872232,Fatima,Eixample,la Sagrada Família,41.4045243794,2.17343856135,Entire home/apt,70,1,7,2018-06-25,4.67,1,33,erased
15643,24987283,"Bright double room, in heart of city",188898079,Leo,Eixample,la Sagrada Família,41.4029792063,2.17617174972,Private room,47,3,9,2018-07-03,5.19,2,84,erased
15644,24988167,Beach Close Nice FLAT,34359990,Evgeny,Sant Martí,el Poblenou,41.4005347807,2.20217013794,Entire home/apt,150,3,1,2018-07-05,1.0,1,84,erased
15645,24989911,Only for families or quiet guests!,159461491,Estrella,Eixample,la Nova Esquerra de l'Eixample,41.3845943746,2.14816227692,Entire home/apt,100,4,2,2018-06-23,1.82,3,352,erased
15646,24990288,Artistic Home El Born,12204003,Evgeniya,Ciutat Vella,"Sant Pere, Santa Caterina i la Ribera",41.3860324746,2.18007911804,Entire home/apt,125,6,1,2018-06-05,0.83,1,18,erased
15647,24990632,Only for families or quiet guests,1791796,Eugeni,Eixample,la Nova Esquerra de l'Eixample,41.3860158956,2.14646895716,Entire home/apt,100,4,5,2018-06-12,2.78,7,352,erased
15652,24993638,City Center Barcelona La Rambla Plaza Catalunya,188949136,Oscar Antonio,Ciutat Vella,el Barri Gòtic,41.3848404341,2.17183791659,Entire home/apt,180,3,4,2018-06-08,2.5,1,72,erased
15661,25004890,Catalan modernist style apartment,1633304,Lrb,Eixample,la Dreta de l'Eixample,41.3925261754,2.17814778711,Entire home/apt,90,3,1,2018-06-19,1.0,5,41,erased
15666,25010538,Nice & quiet room w/private bathroom (girls only!),20837872,Vanessa,Eixample,l'Antiga Esquerra de l'Eixample,41.3903562429,2.15241746494,Private room,40,3,1,2018-06-06,0.86,1,63,erased
15668,25012902,Centro. Vista a las ramblas,189083656,Marina,Ciutat Vella,el Raval,41.379644027,2.17408981333,Entire home/apt,97,3,4,2018-06-07,2.31,1,51,erased
15673,25018898,Big room. City centre. Sag. Familia. Smart TV 50’,54883260,Alejandro,Eixample,la Dreta de l'Eixample,41.3984103001,2.17367738076,Private room,47,5,0,,,2,180,erased
15674,25019771,Estudio elegante/Camp Nou/directo desde aeropuerto,189035353,Nastasia,Sants-Montjuïc,Sants - Badal,41.3754276312,2.12537586636,Entire home/apt,49,1,1,2018-05-31,0.73,2,145,erased
15683,25025197,Female only- cozy room in the centre of Barcelona,185492791,María,Eixample,l'Antiga Esquerra de l'Eixample,41.3860781586,2.15666105602,Private room,25,2,2,2018-07-05,1.05,1,0,erased
15685,25028296,Piso con piscina y playa. Luxury condo with pool.,189205063,Henri,Sant Martí,Diagonal Mar i el Front Marítim del Poblenou,41.4072496811,2.2159419171,Entire home/apt,250,15,0,,,1,52,erased
15691,25033400,Ramblas Apartment,14260609,Sergi,Ciutat Vella,el Raval,41.3806304701,2.16737069805,Entire home/apt,43,1,4,2018-06-18,2.55,1,7,erased
15693,25036522,"Habitacion privad, luminoso, ideal para 1 persona",129089559,Edu,Eixample,la Nova Esquerra de l'Eixample,41.3804601859,2.15039624347,Private room,50,1,5,2018-07-02,2.83,1,211,erased
15694,25039342,Estudio bonito/3/Camp Nou/Directo desde aeropuerto,189035353,Nastasia,Sants-Montjuïc,Sants - Badal,41.3758401236,2.12414327201,Entire home/apt,88,1,1,2018-06-23,1.0,2,150,erased
15695,25039525,P11 - VivoBarcelona Apts.,385249,Joel,Sants-Montjuïc,Hostafrancs,41.3763203735,2.14728308114,Entire home/apt,145,3,1,2018-06-29,1.0,9,218,erased
15699,25041222,Sunny and lovely apartment in Barcelona,189307863,Virginia,Sants-Montjuïc,Hostafrancs,41.3735570886,2.14190586801,Entire home/apt,80,4,0,,,1,2,erased
15706,25043561,Apartment in the historical center of Barcelona,189323340,Elena,Ciutat Vella,el Raval,41.3773677464,2.17360026237,Entire home/apt,120,2,7,2018-07-01,4.77,1,320,erased
15707,25044602,"First line port, near the beach, great views.",176725247,David,Eixample,la Dreta de l'Eixample,41.3855634898,2.16941816841,Entire home/apt,180,5,0,,,2,59,erased
15708,25045014,New Apartment Desing Eixample Antonio Gaudi - B,153943393,Mario,Eixample,la Dreta de l'Eixample,41.3938667086,2.1606500292,Entire home/apt,125,1,2,2018-06-08,1.33,4,70,erased
15709,25045154,Habitación y buen ambiente,148266813,Ana,Nou Barris,Vilapicina i la Torre Llobeta,41.4292071299,2.17819613148,Private room,20,1,1,2018-06-05,0.83,1,0,erased
15710,25047074,Private room in El Borne,139387126,Jackie,Ciutat Vella,"Sant Pere, Santa Caterina i la Ribera",41.3847252163,2.18110211041,Private room,50,5,2,2018-06-22,1.4,1,53,erased
15720,25052787,Pop Apartment next to Rambla del Raval,189398270,Martin,Ciutat Vella,el Raval,41.3788682577,2.16731342119,Entire home/apt,50,1,0,,,1,42,erased
15724,25061457,The House o'fun!,1707035,Damián,Ciutat Vella,el Raval,41.3811700478,2.16620891665,Entire home/apt,95,3,0,,,3,62,erased
15726,25062286,Fresh spot close to everything & Camp Nou,162621142,Ferran,Sants-Montjuïc,Sants,41.3721639777,2.13185966901,Private room,33,2,1,2018-06-16,1.0,1,35,erased
15730,25064741,Cozy room very close to Camp Nou,187923493,Mariana,Les Corts,la Maternitat i Sant Ramon,41.3767871557,2.11306363696,Private room,21,2,2,2018-07-08,2.0,2,5,erased
15731,25066172,Habitación en Barcelona,181733478,Jeff,Sant Andreu,la Sagrera,41.4207606764,2.18890039351,Private room,25,1,0,,,1,251,erased
15734,25067576,Sant Antoni Market City Center Comfy Apartment,189505973,Carlos,Ciutat Vella,el Raval,41.3776887939,2.1656024216,Entire home/apt,190,3,2,2018-06-19,1.62,1,78,erased
15736,25067854,Apartment in Barceloneta perfect for couples,170941315,Michael,Ciutat Vella,la Barceloneta,41.3814384469,2.19103940285,Entire home/apt,63,1,2,2018-06-05,1.54,1,37,erased
15737,25068546,FANTÁSTICO APARTAMENTO ZONA SAGRADA FAMILIA,17829793,NahuelSebastian,Eixample,la Sagrada Família,41.405528667,2.17349087592,Entire home/apt,163,2,8,2018-07-06,5.33,3,324,erased
15739,25069095,Nice Central Room with Private Bathroom,49469592,Cecilia,Ciutat Vella,el Raval,41.3847600705,2.16826830116,Private room,60,1,0,,,4,196,erased
15740,25069163,Central Double Room in Barcelona,183397638,Eva,Ciutat Vella,el Raval,41.3784967592,2.17218771393,Private room,33,1,4,2018-06-12,2.86,1,243,erased
15742,25070334,RAVAL DUPLEX FOR BIG GROUPS 10 MIN WALKING RAMBLAS,189525869,Manuel,Ciutat Vella,el Raval,41.379495826,2.16766047389,Entire home/apt,89,2,3,2018-06-24,3.0,6,288,erased
15744,25072228,Apartamento acogedor y tranquilo,189224397,Felipe,Horta-Guinardó,el Guinardó,41.4228084345,2.17802160494,Private room,50,3,4,2018-06-17,2.18,1,320,erased
15745,25072864,BARCELONA SAGRADA FAMILIA,27586868,German,Eixample,la Sagrada Família,41.4039162236,2.18070192605,Entire home/apt,63,4,3,2018-07-07,2.0,1,283,erased
15748,25073686,Big Beautiful Private Room in shared apartment,30520463,Mariana,Sant Martí,el Poblenou,41.3989718121,2.19987190099,Private room,50,2,4,2018-06-25,3.16,1,0,erased
15755,25078260,Single bedroom in penthouse near Arc del Triomf,140275127,Gala,Eixample,el Fort Pienc,41.3927368656,2.18169414023,Private room,20,1,4,2018-05-19,2.07,1,251,erased
15759,25080623,Sunny rooms with privad Bath and balcony,136903035,Nicole,Sant Martí,el Camp de l'Arpa del Clot,41.4094760405,2.18544712671,Private room,66,2,1,2018-06-09,0.94,1,337,erased
15761,25081678,Cozy and Central apartment in the Born,27996786,Renata,Ciutat Vella,"Sant Pere, Santa Caterina i la Ribera",41.3862132957,2.17924264837,Entire home/apt,94,7,1,2018-06-15,1.0,1,149,erased
15763,25088920,Casa céntrica y recién reformada,99738599,Irene,Sants-Montjuïc,la Bordeta,41.3704284191,2.13122327821,Entire home/apt,65,1,1,2018-05-15,0.53,2,53,erased
15764,25089018,Studio Cosy Gràcia,33592815,Victor,Gràcia,la Vila de Gràcia,41.4069881856,2.15870161261,Entire home/apt,95,2,2,2018-06-24,1.15,1,26,erased
15765,25090272,gran pis sagrada familia,36780006,Juan Carlos,Sant Martí,el Camp de l'Arpa del Clot,41.4108743797,2.18179156524,Entire home/apt,380,4,0,,,5,343,erased
15767,25090798,Flat near Plaza Catalunya,189664807,Nikolay,Ciutat Vella,el Raval,41.3850630429,2.1649601452,Entire home/apt,85,1,3,2018-06-18,2.0,2,83,erased
15769,25091605,Large apartment in the center,146430883,Jordi,Eixample,Sant Antoni,41.3790669737,2.15803863691,Private room,50,1,1,,,3,251,erased
15771,25092441,Design&Cozy studio in downtown's heart -20% OFF,189681252,Alejandro,Ciutat Vella,el Raval,41.3769763205,2.16794350825,Entire home/apt,57,1,4,2018-06-23,2.61,1,12,erased
15772,25092812,"Very centric, cosy flat- next to la Rambla",50175206,Merve,Ciutat Vella,el Barri Gòtic,41.3816326616,2.17406916405,Entire home/apt,150,1,4,2018-06-24,3.16,1,147,erased
15777,25097112,Huge Loft in a top area,185182095,Léa,Sant Martí,el Parc i la Llacuna del Poblenou,41.3973354372,2.18986853095,Entire home/apt,201,1,0,,,1,362,erased
15778,25097138,"Dali 102 - Charming, central and deluxe",39328627,EnjoyBCN,Ciutat Vella,"Sant Pere, Santa Caterina i la Ribera",41.3844971182,2.17927737565,Entire home/apt,255,1,2,2018-07-08,2.0,42,166,erased
15787,25099710,Acogedor apartamento en el centro de Barcelona *B*,10547296,María & Oscar,Les Corts,les Corts,41.3838006177,2.13405407267,Entire home/apt,56,1,0,,,40,320,erased
15789,25102060,"Center of Barcelona, Gothic.",27797267,Benjamin,Ciutat Vella,el Barri Gòtic,41.3809628914,2.17940026482,Entire home/apt,129,5,0,,,1,55,erased
15791,25103968,Comoda habitacion,95670011,Alicia,Gràcia,la Salut,41.4118714879,2.15744018762,Entire home/apt,26,3,4,2018-06-26,2.35,2,266,erased
15794,25107062,Spacious sunny flat in the center of Ciutat Vella,189778504,Patricia,Ciutat Vella,el Barri Gòtic,41.3856214437,2.17301443686,Entire home/apt,120,2,1,2018-06-11,1.0,1,159,erased
15795,25107336,Excelente y confortable piso en Barcelona!,188679307,Daniel,Ciutat Vella,el Raval,41.3759615094,2.17003967966,Entire home/apt,75,1,10,2018-07-08,6.67,2,229,erased
15796,25109004,Light stars,89828774,Charmaine,Sant Martí,la Verneda i la Pau,41.4238781545,2.2095320842,Private room,40,1,3,2018-06-23,3.0,1,353,erased
15797,25109417,CENTRAL APARTM 1 min to RAMBLA and PLAZA CATALUÑA,156929673,Sam,Ciutat Vella,el Raval,41.3839226383,2.1695019309,Entire home/apt,165,2,7,2018-06-25,4.67,5,78,erased
