,id,name,host_id,host_name,neighbourhood_group,neighbourhood,latitude,longitude,room_type,price,minimum_nights,number_of_reviews,last_review,reviews_per_month,calculated_host_listings_count,availability_365,diff_type
7682,14591783,RAVALHEART - BCN CENTER 1 bedroom & large living,2930210,Macu,Ciutat Vella,el Raval,41.3816927673,2.16749555904,Entire home/apt,75,4,0,,,3,65,erased
7689,14603540,Designer 3 bedroom flat in the ♥ of Barcelona!,7156108,Victor,Eixample,la Dreta de l'Eixample,41.3978889542,2.17299479686,Entire home/apt,500,1,13,2017-05-04,0.57,4,365,erased
7690,14603651,Shared room with double bed,7181095,Adrian,Sarrià-Sant Gervasi,Sant Gervasi - Galvany,41.4003004846,2.14932448646,Shared room,15,1,6,2017-12-27,0.27,6,0,erased
7699,14611572,SUPER HABITACIÓN + baño privado,36416821,David,Eixample,l'Antiga Esquerra de l'Eixample,41.3872399002,2.16032917609,Private room,75,2,84,2018-06-19,3.81,3,310,erased
7700,14611653,Super habitación + terraza privada,36416821,David,Eixample,l'Antiga Esquerra de l'Eixample,41.388962644,2.16093520858,Private room,29,2,71,2018-06-21,3.2,3,305,erased
7701,14611726,Habitación confortable en BCN,36416821,David,Eixample,l'Antiga Esquerra de l'Eixample,41.3879468152,2.16076876289,Private room,30,2,48,2018-06-21,2.19,3,131,erased
7709,14625893,"CENTRO BARCELONA, 50M PLAYA , WIFI",527201,Peca,Ciutat Vella,la Barceloneta,41.3780755054,2.19211405737,Entire home/apt,100,2,6,2018-06-24,0.4,1,231,erased
7719,14649739,SPACIOUS & CENTRAL Gotico near Born Marina A/C,90965119,Guy,Ciutat Vella,el Barri Gòtic,41.3803529165,2.18104279773,Entire home/apt,150,3,84,2017-12-23,3.73,1,158,erased
7730,14681011,"Lovely apartment in Born, bright and quiet",91271552,Ana,Ciutat Vella,"Sant Pere, Santa Caterina i la Ribera",41.3860180951,2.18296375052,Entire home/apt,69,2,14,2018-06-04,0.63,1,106,erased
7733,14685864,Luxury Triple Room - Heart of Barcelona,76256391,David,Eixample,la Dreta de l'Eixample,41.3860651536,2.16682371559,Private room,120,1,0,,,3,365,erased
7734,14686519,Luxury Double Room - Heart of Barcelona,76256391,David,Eixample,la Dreta de l'Eixample,41.3876204905,2.16626155219,Private room,115,1,0,,,3,365,erased
7735,14686689,Deluxe Double Room - Heart of Barcelona,76256391,David,Eixample,la Dreta de l'Eixample,41.3875444536,2.1667408781,Private room,110,1,0,,,3,365,erased
7737,14698119,Amazing stylish apartment in Sagrada Familia,35904074,Toni,Eixample,la Sagrada Família,41.4050008041,2.17969698508,Entire home/apt,99,4,1,2016-08-29,0.04,1,9,erased
7752,14751508,2124 - AB Poblenou Beach Comfort - Modern 3-Bedroom Apartment in Poblenou near Avinguda Diagonal,4459553,Eva&Jacques,Sant Martí,el Poblenou,41.404937132,2.20224471417,Entire home/apt,600,2,9,2018-06-26,0.41,148,326,erased
7754,14759707,Beautiful DUPLEX in Barcelona center!,33628710,Pisos,Horta-Guinardó,el Baix Guinardó,41.4102456212,2.1681718148,Entire home/apt,80,6,7,2016-11-01,0.33,6,221,erased
7756,14769206,"TU CUARTO - XL - EIXAMPLE, BARCELONA",8488654,Hector,Eixample,la Nova Esquerra de l'Eixample,41.378837781,2.15206204833,Private room,65,7,5,2017-06-18,0.3,3,173,erased
7761,14793420,RavalHeart: 1 double room + Large living (2 sofás),2930210,Macu,Ciutat Vella,el Raval,41.3802631547,2.1673638218,Entire home/apt,65,4,0,,,3,57,erased
7782,14839843,Double room with private bathroom and balcony,37073076,Jaume,Sarrià-Sant Gervasi,el Putxet i el Farró,41.4103103493,2.13968212881,Private room,30,2,50,2018-07-08,2.25,1,215,erased
7787,14848707,3 Bedroom apartment great option for students,1414702,Ferran,Les Corts,la Maternitat i Sant Ramon,41.3769699319,2.12280894146,Entire home/apt,80,6,2,2017-10-01,0.17,6,75,erased
7838,14974687,Soleada y romántica habitación con salón privado,94330072,Daniela,Sants-Montjuïc,el Poble Sec,41.3724999341,2.16112587703,Private room,40,1,19,2018-07-02,0.86,1,239,erased
7849,15013734,NICE SUITE ROOMS (private bathroom) IN HUGE HOUSE,94754060,Amanda,Sants-Montjuïc,la Bordeta,41.372113635,2.14100427652,Private room,82,2,126,2018-06-17,5.98,1,0,erased
7856,15031651,Habitación centro cerca Rambla,94806825,Stef,Ciutat Vella,el Barri Gòtic,41.3830196252,2.1737344896,Private room,25,2,36,2018-06-23,1.63,1,247,erased
7861,15038009,Isa & family's home,94678676,Isabel,Sants-Montjuïc,Hostafrancs,41.3758123339,2.14593470772,Private room,25,5,3,2017-12-15,0.32,1,60,erased
7863,15045446,1902 - AB Vila i Vilá Apartment 1-1 - Modern Apartment with a Communal Roof Terrace just 15 Minutes from Las Ramblas,4459553,Eva&Jacques,Sants-Montjuïc,el Poble Sec,41.3734434904,2.16912545144,Entire home/apt,600,2,28,2018-06-24,1.37,148,302,erased
7865,15046073,3 Bedroom apartment Great for students,1414702,Ferran,Horta-Guinardó,el Carmel,41.426320443,2.15319280472,Entire home/apt,70,6,0,,,6,348,erased
7867,15049853,1903 - AB Vila i Vilá Apartment 1-2 - Delightful Apartment with a Communal Roof Terrace near Las Ramblas,4459553,Eva&Jacques,Sants-Montjuïc,el Poble Sec,41.3733494871,2.16913826207,Entire home/apt,600,2,9,2018-06-18,0.42,148,326,erased
7868,15050009,1906 - AB Vila i Vilá Apartment 3-1 - Contemporary Apartment with a Communal Roof Terrace near Las Ramblas,4459553,Eva&Jacques,Sants-Montjuïc,el Poble Sec,41.3746809588,2.16903228557,Entire home/apt,600,2,32,2018-07-02,1.49,148,312,erased
7876,15066439,1907 - AB Vila i Vilá Apartment 3-2 - Central Apartment with a Communal Roof Terrace near Las Ramblas,4459553,Eva&Jacques,Sants-Montjuïc,el Poble Sec,41.3747715375,2.16758358695,Entire home/apt,600,2,24,2018-06-24,1.53,148,323,erased
7879,15066805,1911 - AB Vila i Vilá Apartment P-1 - Spacious Apartment with a Communal Roof Terrace near Las Ramblas,4459553,Eva&Jacques,Sants-Montjuïc,el Poble Sec,41.374207716,2.16864772879,Entire home/apt,600,2,24,2018-06-25,1.51,148,327,erased
7880,15066972,1833 - AB Passeig de Grácia Rosselló 2-1 - Amazing 2-Bedroom Apartment with a Balcony near Passeig de Gràcia,4459553,Eva&Jacques,Eixample,la Dreta de l'Eixample,41.3944355536,2.15658207065,Entire home/apt,500,2,11,2018-06-27,0.76,148,336,erased
7888,15093278,bBrick,12713074,Mario,Ciutat Vella,"Sant Pere, Santa Caterina i la Ribera",41.3889340722,2.17724324286,Entire home/apt,75,2,75,2018-06-25,3.59,1,265,erased
7908,15164836,Private room / Barcelona center,3090950,Joan Farré,Eixample,l'Antiga Esquerra de l'Eixample,41.3923102333,2.15707422034,Private room,40,1,8,2018-06-18,0.37,1,180,erased
7910,15171277,1832 - AB Passeig de Gràcia Rosselló 1-2 - Beautiful 2-Bedroom Apartment with a Balcony near Passeig de Gràcia,4459553,Eva&Jacques,Eixample,la Dreta de l'Eixample,41.3944484688,2.15695658011,Entire home/apt,500,2,11,2018-07-03,0.59,148,308,erased
7911,15171621,1774 - AB Saint Joseph Apartment - Modern and Spacious 2-Bedroom Apartment in Eixample near Avinguda Diagonal,4459553,Eva&Jacques,Eixample,l'Antiga Esquerra de l'Eixample,41.3924458654,2.14956478304,Entire home/apt,500,2,5,2018-06-28,1.15,148,329,erased
7912,15174647,Stunning Space in Barcelona Center!,19285954,Alberto,Ciutat Vella,el Raval,41.384521535,2.16922056765,Entire home/apt,150,2,0,,,1,279,erased
7916,15187915,1147 - AB Eixample Viladomat - Lovely 2-Bedroom Eixample Apartment with a Balcony next to Parc de Joan Miró,4459553,Eva&Jacques,Eixample,la Nova Esquerra de l'Eixample,41.3789446769,2.15146499778,Entire home/apt,600,3,3,2018-06-20,0.2,148,312,erased
7917,15188266,1897 - AB Clot Apartment - Beautiful 2-Bedroom Apartment just 15 Minutes from the Sagrada Família,4459553,Eva&Jacques,Sant Martí,el Clot,41.4098818226,2.18840289626,Entire home/apt,500,2,6,2018-06-23,0.39,148,307,erased
7929,15220539,Appartement au calme avec terrasse,96721729,Julie,Horta-Guinardó,el Guinardó,41.4188818341,2.17467438556,Private room,35,5,0,,,1,35,erased
7940,15243736,"Cozy loft facing Port Vell, Wi-Fi, AC",96925856,Josie,Ciutat Vella,el Barri Gòtic,41.3798591625,2.18017391457,Entire home/apt,140,7,12,2018-05-04,0.65,2,365,erased
7943,15245258,"Artistic work space in the center, Wi-Fi, AC",96925856,Josie,Ciutat Vella,"Sant Pere, Santa Caterina i la Ribera",41.3839533141,2.18079409901,Entire home/apt,140,7,11,2018-06-19,0.6,2,31,erased
7948,15252840,Cosy Centric Room,19820665,Katia,Sants-Montjuïc,Hostafrancs,41.3761783002,2.14257185302,Private room,23,3,17,2017-09-15,0.79,1,343,erased
7950,15260634,**Relaxing Bed Room In Barcelona**,97067935,Jacopo,Les Corts,les Corts,41.3811596604,2.1310115378,Private room,29,1,28,2018-07-08,1.34,1,78,erased
7954,15262802,"1554 - AB Passeig de Gràcia Pelai - Modern City Centre Apartment with Balcony, Steps from Plaça de Catalunya",4459553,Eva&Jacques,Ciutat Vella,el Raval,41.385043342,2.16666399214,Entire home/apt,400,3,19,2018-07-01,1.02,148,326,erased
7959,15282409,Habitacion confortable en Sagrada Familia.,49695485,Manuela,Eixample,la Sagrada Família,41.4065713577,2.18069865353,Private room,45,1,26,2018-06-17,1.25,1,207,erased
7966,15310229,"[LastMinute] Duplex, 6 minutes walk to Las Ramblas",2132723,Adry,Ciutat Vella,el Raval,41.3789960258,2.16769905285,Entire home/apt,173,1,31,2018-03-18,1.47,3,36,erased
7976,15348216,"Appartment Centrico, Near la Rambla, 65m2",41691460,Jayjaye,Ciutat Vella,el Raval,41.3813771652,2.17078776623,Entire home/apt,99,1,13,2018-06-28,0.65,1,28,erased
7977,15352320,Double room with balcony Pl Espanya,25503487,Mia,Sants-Montjuïc,el Poble Sec,41.3748468537,2.14905139427,Private room,35,1,9,2018-02-26,0.54,2,364,erased
7980,15354392,APTO. PRIMERO 1,97946425,Eloisa,Sarrià-Sant Gervasi,Sant Gervasi - Galvany,41.3996347003,2.14578432284,Entire home/apt,214,1,0,,,11,231,erased
7981,15354394,APTO. PRIMERO 2,97946425,Eloisa,Sarrià-Sant Gervasi,Sant Gervasi - Galvany,41.3987046843,2.14524234807,Entire home/apt,214,1,0,,,11,237,erased
7982,15354395,APTO. PRINCIPAL 1,97946425,Eloisa,Sarrià-Sant Gervasi,Sant Gervasi - Galvany,41.3981745299,2.14667836338,Entire home/apt,214,1,0,,,11,297,erased
7983,15354396,APTO. PRINCIPAL 2,97946425,Eloisa,Sarrià-Sant Gervasi,Sant Gervasi - Galvany,41.3996654799,2.14535197163,Entire home/apt,214,1,0,,,11,328,erased
7984,15354398,APTO. SEGUNDO 2,97946425,Eloisa,Sarrià-Sant Gervasi,Sant Gervasi - Galvany,41.3976718326,2.14563678712,Entire home/apt,214,1,0,,,11,192,erased
7985,15354399,APTO. TERCERO 1,97946425,Eloisa,Sarrià-Sant Gervasi,Sant Gervasi - Galvany,41.3981090563,2.14600977564,Entire home/apt,214,1,0,,,11,59,erased
7986,15354400,APTO. CUARTO 1,97946425,Eloisa,Sarrià-Sant Gervasi,Sant Gervasi - Galvany,41.3982123453,2.1452273286,Entire home/apt,214,1,0,,,11,0,erased
7987,15354401,APTO. LOFT 2,97946425,Eloisa,Sarrià-Sant Gervasi,Sant Gervasi - Galvany,41.3993949525,2.14711228644,Entire home/apt,214,1,0,,,11,305,erased
7988,15354402,APTO. TERCERO 2,97946425,Eloisa,Sarrià-Sant Gervasi,Sant Gervasi - Galvany,41.3980336746,2.14687197812,Entire home/apt,214,1,0,,,11,221,erased
7989,15354403,APTO. CUARTO 2,97946425,Eloisa,Sarrià-Sant Gervasi,Sant Gervasi - Galvany,41.3978801379,2.14672652801,Entire home/apt,214,1,0,,,11,207,erased
7994,15371119,Sagrrada Familia Cozy,18096277,Jon  & Jon,Eixample,la Sagrada Família,41.4039331811,2.17554862079,Entire home/apt,65,5,43,2018-06-26,2.04,6,188,erased
8001,15405031,Charming vintage apartment in the Sagrada Familia for 4,98608422,Carolina,Eixample,el Fort Pienc,41.3992684964,2.17585954079,Entire home/apt,100,3,7,2018-01-04,0.37,1,0,erased
8013,15431563,RAMBLAS NEW,3039107,Manuel,Ciutat Vella,el Raval,41.3841443581,2.16769444686,Entire home/apt,74,89,18,2017-12-31,0.88,17,292,erased
8014,15431792,The Relax Room in Sagrada Familia,2077920,Claudia,Eixample,la Sagrada Família,41.4076321551,2.17783161452,Private room,25,3,19,2018-05-21,0.91,3,121,erased
8015,15432792,XL 2-DOUBLE-BEDS BEDROOM IN SHARED SPACIOUS APT.,10052309,Julio Miguel,Sant Martí,el Clot,41.4082634562,2.18840437362,Private room,35,32,18,2018-01-28,0.9,3,228,erased
8017,15433722,"BY THE SEA - Modern, Cosy and right in the Center!",98946335,Nicolas,Ciutat Vella,la Barceloneta,41.3782684998,2.1908606824,Entire home/apt,95,3,21,2018-07-06,1.04,1,3,erased
8019,15434062,DOUBLE BEDROOM IN SHARED SPACIOUS APARTMENT,10052309,Julio Miguel,Sant Martí,el Clot,41.4066025343,2.18886329286,Private room,30,32,15,2018-02-01,0.77,3,322,erased
8020,15434376,LARGE 2-DOUBLE-BEDS BEDROOM IN SHARED SPACIOUS APT,10052309,Julio Miguel,Sant Martí,el Clot,41.4080808751,2.18846884232,Private room,35,32,22,2018-01-31,1.07,3,323,erased
8026,15445245,Ideal Big Private Suite in the heart of BCN/P.Bath,99061885,Lucas,Sarrià-Sant Gervasi,Sant Gervasi - Galvany,41.4000504611,2.14310072187,Private room,60,2,67,2018-07-04,3.27,1,332,erased
8031,15462152,Double room for couple,78159634,Roberto,Sant Martí,el Camp de l'Arpa del Clot,41.4137654305,2.18420957244,Private room,40,1,2,2017-07-22,0.16,1,68,erased
8048,15517427,lovely double room in Clot A,76197586,Judith,Sant Martí,el Clot,41.4134138355,2.19043013546,Private room,42,2,87,2018-07-01,4.22,2,49,erased
8050,15521167,Cosy room with terrace at Hospital de Sant Pau,17198103,Karolin,Horta-Guinardó,el Guinardó,41.416300135,2.1744309023,Entire home/apt,50,5,8,2017-03-28,0.38,1,0,erased
8056,15544598,Large interior room with small studio & terrace,292920,Catalina,Eixample,Sant Antoni,41.3833110006,2.16287660735,Private room,55,2,24,2018-06-17,1.32,2,37,erased
8069,15579508,Beautiful Apartament DownTown,75544311,Pedro,Sarrià-Sant Gervasi,el Putxet i el Farró,41.4036289734,2.14641644586,Entire home/apt,100,1,43,2018-07-06,2.1,2,42,erased
8072,15582902,Sunny and  Bright Loft close to the Beach,16466099,Otti,Sant Martí,la Vila Olímpica del Poblenou,41.3931562803,2.19338037756,Private room,50,2,15,2018-06-26,0.73,2,66,erased
8091,15628028,Apartment BCN city 10 min walk Beach,75544311,Pedro,Sant Martí,el Poblenou,41.4029177788,2.19899842685,Entire home/apt,85,1,81,2018-07-04,4.15,2,169,erased
8101,15645411,Comfortable and convenient flat in Sagrada Familia,100940824,Cauro,Eixample,la Dreta de l'Eixample,41.400202384,2.17147394549,Entire home/apt,43,3,12,2017-01-31,0.59,1,0,erased
8115,15684618,BUENA HABITACION PRIVADA CENTRO,101230854,Ana María G,Eixample,el Fort Pienc,41.3941235215,2.18334488346,Private room,27,4,10,2018-06-02,0.72,6,122,erased
8117,15700116,Penthouse whit solarium Clot-Glories HUTB (Phone number hidden by Airbnb),17391341,Elsa,Sant Martí,el Clot,41.4073167592,2.18685971555,Entire home/apt,90,2,51,2018-06-29,2.49,3,269,erased
8120,15711166,QUIET & COZY WITH TERRACE,6907539,Jud,Ciutat Vella,el Raval,41.3835785326,2.16590652821,Entire home/apt,40,2,37,2018-07-01,1.87,2,87,erased
8125,15712249,"327 - AB Central Villarroel - Trendy City Centre Apartment with a Balcony, 15 Minutes from Plaça de Catalunya",4459553,Eva&Jacques,Eixample,Sant Antoni,41.3819973054,2.16161972975,Entire home/apt,500,3,2,2018-06-23,0.97,148,300,erased
8130,15715441,COZY CENTRAL PENTHOUSE,6907539,Jud,Ciutat Vella,el Raval,41.3821161048,2.16506154359,Entire home/apt,84,2,38,2018-03-24,1.88,2,145,erased
8132,15723593,Park Guell with Private Backyard,51188274,Michael,Gràcia,la Vila de Gràcia,41.4083964177,2.1592556936,Entire home/apt,265,3,0,,,1,358,erased
8145,15748534,Beautiful Room in Gracia,10430464,Lara,Gràcia,la Vila de Gràcia,41.4056996952,2.15735459192,Private room,55,2,4,2017-09-04,0.27,2,92,erased
8160,15780627,Beautiful 80m2 Apartment Btw Borne and Barceloneta,5323645,Ana,Ciutat Vella,"Sant Pere, Santa Caterina i la Ribera",41.3836133694,2.18467754544,Entire home/apt,80,1,4,2017-12-12,0.22,2,22,erased
8162,15783134,5min walk Park Güell  25min metro to Beach/Center,27266266,Miah & Hameem,Gràcia,la Salut,41.4109872664,2.1495824317,Private room,22,2,56,2018-06-11,3.01,3,83,erased
8163,15784194,BARCELONA OLYMPIC APARTMENT,48341644,Javier,Sant Martí,la Vila Olímpica del Poblenou,41.3916904742,2.19497522985,Entire home/apt,220,1,12,2018-06-10,0.79,1,80,erased
8174,15812046,Mobile World Congress 250/night 3 night minimm,30748779,Matthew,Sants-Montjuïc,Sants,41.3748196678,2.13950144417,Entire home/apt,116,1,0,,,2,0,erased
8175,15812388,Unique Sants BCN Chic,30748779,Matthew,Sants-Montjuïc,la Bordeta,41.3720349492,2.13902775879,Entire home/apt,150,3,1,2016-12-17,0.05,2,89,erased
8186,15838235,Cozy room en Sarria!,25512511,Paola,Sarrià-Sant Gervasi,Sarrià,41.3975811661,2.11919025143,Private room,20,2,7,2017-08-12,0.37,1,360,erased
8195,15854127,Rome en Barcelona,34338444,Mara,Nou Barris,la Trinitat Nova,41.4472943613,2.1836901652,Entire home/apt,128,3,1,2018-06-19,1.0,5,343,erased
8196,15854496,Triple Room with Balcony and Shared Bathroom,102733863,Cristian,Eixample,l'Antiga Esquerra de l'Eixample,41.3901777068,2.15721711545,Private room,42,1,11,2018-07-03,0.58,4,126,erased
8208,15870466,Lolita B and B - Double Room with Shared Bathroom,102733863,Cristian,Eixample,l'Antiga Esquerra de l'Eixample,41.3911717871,2.15537434448,Private room,29,1,0,,,4,152,erased
8209,15870836,Lolita B and B - Twin Room with Shared Bathroom,102733863,Cristian,Eixample,l'Antiga Esquerra de l'Eixample,41.3914148313,2.15681051029,Private room,32,1,0,,,4,127,erased
8210,15871037,Lolita B and B - Double Room with Private Bathroom,102733863,Cristian,Eixample,l'Antiga Esquerra de l'Eixample,41.391631826,2.15531245938,Private room,33,1,1,2017-02-01,0.06,4,117,erased
8226,15910452,Double Bedroom with privet Balcony,1412371,Herika,Horta-Guinardó,Horta,41.4340466115,2.15536800559,Private room,60,31,0,,,1,6,erased
8263,16001037,Charming Gothic One-Bedroom Flat,15963269,Amanda,Ciutat Vella,el Barri Gòtic,41.3846051479,2.1749316988,Entire home/apt,50,30,1,2018-06-30,1.0,1,344,erased
8266,16007631,An amazing apartment with views of the Sagrada Familia cathedral.,98330509,Apart-Suites,Eixample,la Sagrada Família,41.4019007268,2.17348355386,Entire home/apt,170,2,20,2018-07-05,1.06,3,168,erased
8268,16009172,2216 - AB Bailén Apartment P-1 - Contemporary Apartment with a Private Terrace near the Sagrada Família,4459553,Eva&Jacques,Eixample,la Dreta de l'Eixample,41.3954159988,2.17068755874,Entire home/apt,600,2,25,2018-06-19,1.74,148,311,erased
8269,16009455,2217 - AB Bailén Apartment 2-2 - Bright Apartment with a Balcony 15 Minutes from the Sagrada Família,4459553,Eva&Jacques,Eixample,la Dreta de l'Eixample,41.3970664794,2.17120974116,Entire home/apt,600,2,10,2018-06-17,0.72,148,319,erased
8281,16024686,"3tnf LET'S STAY IN AN AUTHENTIC FACTORY, GREAT!!!!",3911721,Aurora,Sants-Montjuïc,el Poble Sec,41.3723674892,2.16635327491,Entire home/apt,105,1,1,2017-04-03,0.06,26,300,erased
8282,16025348,"Comfy private room, bathroom private. Love.",40314857,Emile,Sants-Montjuïc,el Poble Sec,41.3730193204,2.16061893846,Private room,45,2,37,2018-06-15,2.24,1,248,erased
8288,16046714,Amazing penthouse for the World Mobile Congress,104328163,Joaquin,Horta-Guinardó,el Guinardó,41.4207573871,2.17381891556,Entire home/apt,200,1,1,2017-03-07,0.05,1,37,erased
8308,16062319,CONCEPT - Apartamento Céntrico de Diseño,104621045,Host,Sants-Montjuïc,el Poble Sec,41.3727093031,2.16604421009,Entire home/apt,79,2,7,2018-06-13,0.38,2,338,erased
8311,16074153,lugar de armonía naturaleza y ocio,42767000,Diana,Sants-Montjuïc,el Poble Sec,41.3735185415,2.16012290243,Private room,50,1,0,,,1,180,erased
8325,16084535,Dorman Place,58383611,Dorman,Ciutat Vella,el Raval,41.3800244973,2.1717493909,Private room,50,1,84,2018-06-24,4.27,1,327,erased
8326,16091084,LOVELY APARTMENT WHIT ROOFTOP CITY CENTER,104878162,Mónica,Ciutat Vella,el Raval,41.3847281033,2.16571116021,Entire home/apt,93,5,20,2018-06-17,1.08,1,64,erased
8329,16095616,"room doble in a nice apartament, habitacion doble",104912186,Sol,Sants-Montjuïc,el Poble Sec,41.3741347976,2.15823519435,Private room,60,2,13,2018-06-16,0.7,1,173,erased
8330,16096175,Single room close to park guell,6718149,Bale,Eixample,la Dreta de l'Eixample,41.399385291,2.16821789254,Private room,18,30,36,2018-07-05,2.07,2,80,erased
8340,16116126,Standard 1 bedroom + 1 bathroom roof,104876399,Charmsuites,Ciutat Vella,el Raval,41.3751647556,2.16804200092,Entire home/apt,170,1,2,2018-03-25,0.12,6,107,erased
8341,16116128,Standard 1 bedroom + 1 bathroom terrace,104876399,Charmsuites,Ciutat Vella,el Raval,41.3755625547,2.16826002984,Entire home/apt,170,1,8,2018-06-04,0.48,6,128,erased
8342,16116129,Standard 1 bedroom + 1 bathroom big terrace,104876399,Charmsuites,Ciutat Vella,el Raval,41.3757561359,2.16988611032,Entire home/apt,190,1,4,2017-09-22,0.26,6,132,erased
8343,16116131,Standard 2 bedroom + 2 bathroom big terrace,104876399,Charmsuites,Ciutat Vella,el Raval,41.3754450353,2.16831248524,Entire home/apt,260,1,23,2018-06-16,1.56,6,98,erased
8344,16116135,Standard 1 bedroom + 1 bathroom balcony,104876399,Charmsuites,Sants-Montjuïc,el Poble Sec,41.3734336552,2.1685504789,Entire home/apt,130,1,4,2018-05-18,0.27,6,127,erased
8345,16116138,Big apartment 2 bedroom + 1 bathroom,104876399,Charmsuites,Sants-Montjuïc,el Poble Sec,41.3736845042,2.17007405517,Entire home/apt,190,1,31,2018-06-20,1.82,6,107,erased
8354,16131031,Large Studio 2min walk from Pl.Catalunya,41657332,Pedro,Eixample,la Dreta de l'Eixample,41.3872374403,2.16972187889,Entire home/apt,80,3,9,2017-10-16,0.48,1,0,erased
8358,16146209,Single room in the heart of Gràcia.,52265685,Stefy,Gràcia,la Vila de Gràcia,41.4024478766,2.15222507913,Private room,20,15,3,2018-02-04,0.32,1,29,erased
8359,16151408,MARINA - Apartamento para grupos grandes!!,104621045,Host,Sant Martí,el Parc i la Llacuna del Poblenou,41.3933240779,2.18915344181,Entire home/apt,120,2,6,2018-06-16,0.32,2,327,erased
8362,16160645,Luxury House + Private Patio,8219588,Isa,Sarrià-Sant Gervasi,Sant Gervasi - Galvany,41.3971011292,2.1501569355,Entire home/apt,277,4,2,2017-12-28,0.19,1,50,erased
8372,16182552,SUNNY DOUBLE-DOUBLE ROOM 3P + BALCONY - EIXAMPLE,105255519,Marc,Eixample,Sant Antoni,41.3814989063,2.16182985455,Private room,36,3,49,2018-06-24,2.58,2,147,erased
8374,16190919,"Not Just A Room in the ""Best"" Barrio of Barcelona!",105730160,A,Gràcia,la Vila de Gràcia,41.4000670364,2.15930806896,Private room,40,3,32,2018-07-02,1.94,1,86,erased
8379,16204474,"2""COZY & DOWNTOWN ROOM / HABITACION CÉNTRICA""",13638491,Anton,Eixample,l'Antiga Esquerra de l'Eixample,41.3866262049,2.15684313301,Private room,36,1,74,2018-06-08,3.83,6,24,erased
8385,16218757,Apartment close to Rambla Barcelona,71126555,Maria,Ciutat Vella,el Raval,41.3770103583,2.16577356737,Entire home/apt,120,365,11,2018-06-10,0.59,1,11,erased
8387,16227968,Camas en Gràcia,27416435,Antonio,Gràcia,la Vila de Gràcia,41.4051746566,2.15409437284,Private room,29,1,4,2018-07-01,0.21,2,249,erased
8402,16253068,Habitación en Gràcia,27416435,Antonio,Gràcia,la Vila de Gràcia,41.4030519921,2.15207476714,Shared room,20,1,3,2018-06-27,0.16,2,247,erased
8405,16255841,WHOLE RENOVATED APARTMENT. PRIME LOCATION!,16187289,Paul,Eixample,la Dreta de l'Eixample,41.3956619682,2.17088032389,Entire home/apt,200,4,0,,,1,358,erased
8419,16285442,Precioso apartamento en la playa,70539514,RoSaura,Ciutat Vella,la Barceloneta,41.3768900679,2.18904800586,Entire home/apt,100,4,16,2017-07-28,0.97,1,128,erased
8431,16330576,Habitación acogedora en casa 3 plantas,106896976,Ana,Sants-Montjuïc,Sants,41.3742181608,2.13889031184,Private room,24,3,17,2018-05-30,0.99,1,0,erased
8438,16344869,"Music VII, Friendly Rentals",102947901,Claudia,Ciutat Vella,"Sant Pere, Santa Caterina i la Ribera",41.3874921264,2.17695742933,Entire home/apt,100,1,29,2018-06-13,1.82,128,285,erased
8440,16349623,Designer Style Luxury • BORNE 5★  •  Barcelona,4007608,Adrian,Ciutat Vella,"Sant Pere, Santa Caterina i la Ribera",41.3833318236,2.18096669604,Entire home/apt,249,3,9,2017-11-27,0.49,1,0,erased
8478,16410468,Family apartment.,107525686,Yudith&Juan,Eixample,la Sagrada Família,41.4034482726,2.17449242395,Entire home/apt,96,5,4,2018-07-07,0.22,4,89,erased
8479,16410617,Cozy Marina,107525686,Yudith&Juan,Eixample,la Sagrada Família,41.4040527567,2.17674039093,Entire home/apt,60,5,3,2017-03-19,0.16,4,58,erased
8482,16422313,Sunny and Central Apartment AMAZING VIEW!!,80255410,Dante,Eixample,el Fort Pienc,41.401253326,2.17963061639,Entire home/apt,260,4,1,2018-06-19,1.0,3,349,erased
8521,16497459,Lovely room in Barcelona center,102876877,Dana,Eixample,l'Antiga Esquerra de l'Eixample,41.3833469922,2.15999957447,Private room,28,2,6,2017-02-07,0.32,2,48,erased
8546,16564261,Quiet penthouse with great terrace in city centre.,94331141,Antonius,Eixample,la Nova Esquerra de l'Eixample,41.3829856288,2.15589475008,Entire home/apt,120,4,3,2018-05-22,0.17,1,0,erased
8559,16597057,"""3.2 Red Flat"" Quick way to center & airport",109478015,Leo,Les Corts,la Maternitat i Sant Ramon,41.3795757436,2.11671358715,Entire home/apt,3000,2,85,2018-06-23,4.64,3,73,erased
8587,16680921,Entire flat 3/4 person,64136534,Kate,Sant Andreu,Navas,41.4176983341,2.18294797903,Entire home/apt,70,3,5,2018-05-13,0.3,1,81,erased
8605,16719228,Gorgeous Room + Studio + Terrace!,110811448,Maria Rosa,Sants-Montjuïc,Sants,41.3781500478,2.13751396754,Private room,75,2,9,2018-06-17,0.6,1,311,erased
8618,16741063,CUTE & SUNNY WITH TERRACE,111044671,Roberto,Sants-Montjuïc,el Poble Sec,41.3732774723,2.1590052014,Entire home/apt,76,6,63,2018-06-23,3.8,1,259,erased
8622,16748294,"Spacious room, nearby Aerobus and Plaza Catalunya",8529271,Liza,Eixample,l'Antiga Esquerra de l'Eixample,41.3832806453,2.15918312174,Private room,65,2,21,2018-06-03,1.23,1,127,erased
8624,16749826,Raval,40364868,Alexandra,Ciutat Vella,el Raval,41.3816126494,2.16644734896,Entire home/apt,150,3,12,2018-05-08,0.73,1,105,erased
8631,16762761,Lovely flat in Gracia neighborhood,4077942,Jose,Gràcia,la Vila de Gràcia,41.3985696398,2.15900610683,Entire home/apt,100,5,0,,,1,51,erased
8632,16765218,APART. COMFORTABLE   BRIGTH  & SUITE&SINGLE ROOM,81829743,Mayla,Gràcia,la Vila de Gràcia,41.398202579,2.15639612023,Private room,55,3,27,2018-06-25,1.63,2,30,erased
